movieId,lucationUrl,locationRef,city/country,area/street,location
165,https://www.movie-locations.com/movies/d/Die-Hard-With-A-Vengeance-Audobon-Avenue.jpg, Zeus Carver is tipped off about“ the crazy white man” at his electronics store, New York, Washington Heights, Audobon Avenue
165,https://www.movie-locations.com/movies/d/Die-Hard-With-A-Vengeance-72nd-Street-Station.jpg, Simon Gruber sets the “St Ives” riddle, New York, West Side, Broadway at 72nd Street
165,https://www.movie-locations.com/movies/d/Die-Hard-With-A-Vengeance-Federal-Reserve-Bank.jpg, Gruber’s real target, New York, Liberty Street, Federal Reserve Bank
165,https://www.movie-locations.com/movies/d/Die-Hard-With-A-Vengeance-Tomkins-Square.jpg, the problem at the elephant fountain, New York, East Village, Tomkins Square Park
165,https://www.movie-locations.com/movies/d/Die-Hard-With-A-Vengeance-Alexander-Humboldt-School.jpg, disarming the bomb at ‘Chester A Arthur Public School’, New York, Washington Heights," West 177th Street,  Alexander Humboldt School"
1036,https://www.movie-locations.com/movies/d/Die-Hard-Fox-Plaza.jpg, John McClane defends ‘Nakatomi Tower’, Los Angeles, Century City," 2121 Avenue of the Stars,  Fox Plaza"
5872,https://www.movie-locations.com/movies/d/Die-Another-Day-Reform-Club.jpg, The duel in  ‘Blades’, London SW1, Pall Mall, The Reform Club
5872,https://www.movie-locations.com/movies/d/Die-Another-Day-Simpson-House-Dalston.jpg, the interior of the Cuban cigar factory, London, Dalston," Stoke Newington Road,  Simpson House"
5872,https://www.movie-locations.com/movies/d/Die-Another-Day-Westminster-Bridge.jpg, The entrance to ‘Vauxhall Cross’, London SW1, Westminster Bridge,
5872,https://www.movie-locations.com/movies/d/../w/World-Is-Not-Enough-Vauxhall-Cross.jpg, MI6 HQ, London SE11, Vauxhall Cross, SIS Building
5872,https://www.movie-locations.com/movies/d/../0/1408-Reform-Club.jpg, the lobby of the fictitious club 'Blades', London SW1, Pall Mall, The Reform Club
8873,https://www.movie-locations.com/movies/m/Motorcycle-Diaries-Machu-Picchu.jpg," Machu Picchu, Per", Peru, Machu Picchu,
3984,https://www.movie-locations.com/movies/d/Diamonds-Are-Forever-Westgate-Las-Vegas.jpg, the 'Whyte House', Las Vegas, Paradise Road, Westgate Las Vegas Resort & Casino
3984,https://www.movie-locations.com/movies/d/Diamonds-Are-Forever-Palm-Mortuary-Henderson.jpg, the 'Slumber Inc Mortuary', Nevada, Henderson," Boulder Highway,  Palm Henderson Mortuary"
3984,https://www.movie-locations.com/movies/d/Diamonds-Are-Forever-Circus-Circus.jpg, Bond meets up with Tiffany Case, Las Vegas, Las Vegas Boulevard South, Circus Circus
3984,https://www.movie-locations.com/movies/d/Diamonds-Are-Forever-Tropicana-Las-Vegas.jpg, Bond’s hotel, Las Vegas, Las Vegas Boulevard South, the Tropicana
3984,https://www.movie-locations.com/movies/d/Diamonds-Are-Forever-Elrod-House.jpg, Whyte's 'winter villa', Palm Springs, Southridge Drive, the Elrod House
34323,https://www.movie-locations.com/movies/d/Devils-Rejects-Club-Ed-Easy-Rest-Inn.jpg, the ‘Kahiki Palms Motel’, California, Lancaster," 150th Street,  Club Ed"
34323,https://www.movie-locations.com/movies/d/Devils-Rejects-Club-Ed-office.jpg, the ‘Kahiki Palms Motel’, California, Lancaster," 150th Street,  Club Ed"
1645,https://www.movie-locations.com/movies/d/Devils-Advocate-Central-Presbyterian-Church.jpg, John Milton gets the font water to boil at his satanic touch, New York, 593 Park Avenue near 64th Street, Central Presbyterian Church
1645,https://www.movie-locations.com/movies/d/Devils-Advocate-Holy-Redeemer-Church.jpg, John Milton gets the font water to boil at his satanic touch, New York, East Third Street, Most Holy Redeemer Church
45720,https://www.movie-locations.com/movies/d/Devil-Wears-Prada-Bubbys.jpg, Andy celebrates her new job at Runway magazine, New York, Tribeca," Hudson Street,  Bubby’s"
45720,https://www.movie-locations.com/movies/d/Devil-Wears-Prada-Broome-Street.jpg, Andy Sachs’s Manhattan apartment, New York, Lower East Side, Broome Street
45720,https://www.movie-locations.com/movies/d/Devil-Wears-Prada-McGraw-Hill.jpg, Andy Sachs gets a job at Runway magazine, New York, West 48th Street, McGraw-Hill Building
45720,https://www.movie-locations.com/movies/d/Devil-Wears-Prada-Craft.jpg,,-,-,k
45720,https://www.movie-locations.com/movies/d/Devil-Wears-Prada-Crosby-Street.jpg,,-,-,k
45720,https://www.movie-locations.com/movies/d/Devil-Wears-Prada-East-73rd-Street.jpg, Andy delivers ‘the book’ to Miranda Priestly ’s townhouse, New York, Upper East Side, East 73rd Street
45720,https://www.movie-locations.com/movies/d/Devil-Wears-Prada-Smith-&-Wollensky.jpg, Andy gets Miranda’s steak, New York, 3rd Avenue, Smith & Wollensky
45720,https://www.movie-locations.com/movies/d/../f/First-Wives-Club-King-Cole-Bar.jpg, Andy picks up the new Harry Potter book, New York, East 55th Street," St Regis Hotel,  King Cole Bar"
45720,https://www.movie-locations.com/movies/d/Devil-Wears-Prada-Museum-Of-Natural-History.jpg, the glitzy benefit, New York, Central Park West, American Museum of Natural History
45720,https://www.movie-locations.com/movies/d/Devil-Wears-Prada-Absinthe.jpg, Andy enjoys a meal with Christian in ‘Paris’, New York, East 67th Street, L’Absinthe
3875,https://www.movie-locations.com/movies/d/Devil-Rides-Our-Manor-Hotel-Elstree.jpg, the night in the chalk circle, Hertfordshire, Elstree," Barnet Lane,  Manor Hotel"
164,https://www.movie-locations.com/movies/d/Devil-In-A-Blue-Dress-South-Main-Street.jpg, ‘Joppy’s bar’ on ‘Central Avenue’ of the 1940s, downtown Los Angeles, South Main Street, the Canadian Building
164,https://www.movie-locations.com/movies/d/Devil-In-A-Blue-Dress-Harcourt-Avenue.jpg, the home of 'Easy' Rawlins, Los Angeles, Jefferson Park, South Harcourt Avenue
164,https://www.movie-locations.com/movies/d/Devil-In-A-Blue-Dress-El-Cadiz.jpg, Rawlins goes to see Albright about taking on a job, Los Angeles, Hollywood," North Sycamore Avenue,  El Cadiz"
164,https://www.movie-locations.com/movies/d/../n/Nightmare-On-Elm-Street-Los-Angeles-City-Jail.jpg," after the murder of Coretta, Easy is hauled off to the cop station", Los Angeles, Lincoln Heights," North Avenue 19,  Lincoln Heights Jail"
164,https://www.movie-locations.com/movies/d/Devil-In-A-Blue-Dress-Club-Fais-Do-Do.jpg, the jazz club, Los Angeles, West Adams Boulevard, Club Fais Do Do
164,https://www.movie-locations.com/movies/d/Devil-In-A-Blue-Dress-Griffith-Observatory.jpg," Carter breaks up with Daphne, and Easy hands over the photographs", Los Angeles, Griffith Park, Griffith Observatory
2369,https://www.movie-locations.com/movies/d/Desperately-Seeking-Susan-Love-Saves-The-Day.jpg, Roberta buys Susanâs jacket, New York, St Mark's Place," 2nd Avenue,  Love Saves The Day (since closed)"
48516,https://www.movie-locations.com/movies/d/Departed-Lindemann-Center.jpg, headquarters of the ‘Special Investigation Unit’, Boston, Staniford Street at Merrimac Street, Lindemann Center
48516,https://www.movie-locations.com/movies/d/Departed-Park-Luncheonette.jpg, Young Colin first meets boss Frank Costello in the grocery store, Brooklyn, Greenpoint," Driggs Avenue,  Park Luncheonette"
48516,https://www.movie-locations.com/movies/d/Departed-Lindemann-Center-Staniford-Street.jpg, headquarters of the ‘Special Investigation Unit’, Boston, Staniford Street at Merrimac Street, Lindemann Center
48516,https://www.movie-locations.com/movies/d/Departed-Tremont-Street.jpg, Colin Sullivan is set up in a luxury penthouse, Boston, Tremont Street, Suffolk University Law School
48516,https://www.movie-locations.com/movies/d/Departed-Massachusetts-State-House.jpg, corrupt cop Colin Sullivan sees the gleaming golden dome from his luxury apartment, Boston, Beacon Street, Massachusetts State House
48516,https://www.movie-locations.com/movies/d/Departed-Barbetta.jpg, Colin dines in luxury with shrink Madolyn, New York, West 46th Street, Barbetta
48516,https://www.movie-locations.com/movies/d/Departed-Flagship-Wharf.jpg, the luxury block of mob boss Frank Costello, Boston, Charlestown," 8th Street,  Flagship Wharf"
48516,https://www.movie-locations.com/movies/d/Departed-Fernandos-Focacceria.jpg, Billy takes shrink Madolyn for coffee, Brooklyn, Cobble Hill," Union Street,  Fernando’s Focacceria"
48516,https://www.movie-locations.com/movies/d/Departed-Cinema-Village.jpg, Colin meets Frank Costello at the porn cinema, New York, East 12th Street, Cinema Village
48516,https://www.movie-locations.com/movies/d/Departed-Charles-Street.jpg," the exterior of the ‘Charles Street Brasserie’, Costelloâs headquarters", Boston, Beacon Hill," Charles Street,  Charles Street Cleaners"
48516,https://www.movie-locations.com/movies/d/Departed-Raouls-Restaurant.jpg," the interior of the ‘Charles Street Brasserie’, Costello's headquarters", Manhattan, Prince Street, Raoul’s Restaurant
442,https://www.movie-locations.com/movies/d/Demolition-Man-America-Plaza-San-Diego.jpg, the ride to Taco Bell, Downtown San Diego, America Plaza,
2871,https://www.movie-locations.com/movies/d/Deliverance-Tallulah-Gorge.jpg, the fictitious âCahulawassee Riverâ, Georgia, Tallulah Gorge,
1263,https://www.movie-locations.com/movies/d/Deer-Hunter-Mingo-Junction-bridge.jpg, the opening scene of the town, Ohio, Mingo Junction, Logan Avenue
1263,https://www.movie-locations.com/movies/d/Deer-Hunter-Mingo-Junction.jpg, the steel town, Ohio, Mingo Junction,
1263,https://www.movie-locations.com/movies/d/Deer-Hunter-St-Theodosius.jpg, the wedding of Steven and Angela, Cleveland, Starkweather Avenue, St Theodosius Russian Orthodox Cathedral
1263,https://www.movie-locations.com/movies/d/Deer-Hunter-Starkweather-Avenue.jpg, Linda works in the ‘Eagle Supermarket’, Cleveland, Starkweather Avenue,
1263,https://www.movie-locations.com/movies/d/Deer-Hunter-Lemko-Hall.jpg, the wedding reception, Cleveland, West 11th Street, Lemko Hall
1263,https://www.movie-locations.com/movies/d/Deer-Hunter-Bowladrome.jpg, the bowling alley, Ohio, Struthers," State Street,  Bowladrome Lanes"
53519,https://www.movie-locations.com/movies/d/Death-Proof-Gueros.jpg, Jungle Julia meets up with her friends, Austin, South Congress Avenue, Guero's Taco Bar
222593,https://www.movie-locations.com/movies/d/Death-On-The-Nile-Old-Cataract-Hotel.jpg, the boat departs from the Egyptian hotel,-,-, Old Cataract Hotel
222593,https://www.movie-locations.com/movies/d/Death-On-The-Nile-Abu-Simbel.jpg, tJacqueline turns up to spoil the fun, Egypt, Abu Simbel,
86559,https://www.movie-locations.com/movies/d/Death-Line-Grafton-Mansions.jpg, the apartment of Alex and Patricia, London WC1, Bloomsbury," Duke's Road,  Grafton Mansions"
6684,https://www.movie-locations.com/movies/d/Death-In-Venice-Hotel-Des-Bains.jpg, Aschenbach’s hotel, Venice, Lido," Lungomare Marconi 41,  Grand 
        Hotel des Bains"
6684,https://www.movie-locations.com/movies/d/Death-In-Venice-Fenice-sharp.jpg, Aschenbach follows Tadzio, Venice, Dietro La Fenice,
6684,https://www.movie-locations.com/movies/d/Death-In-Venice-Calegheri.jpg, disinfecting the city, Venice, Campiello dei Calegheri,
6684,https://www.movie-locations.com/movies/d/Death-In-Venice-bank.jpg, Aschenbach finds out about the plague, Venice, Piazza San Marco, Banca Commerciale Italiana
3258,https://www.movie-locations.com/movies/d/Death-Becomes-Her-Greystone-Mansion.jpg, the funeral home where Ernest works, Los Angeles, Beverly Hills, Greystone Park And Mansion
3258,https://www.movie-locations.com/movies/d/Death-Becomes-Her-Wilshire-Ebell-Theatre.jpg, Madeline Ashton stars in Songbird! on 'Broadway', Los Angeles, Midtown," West 8th Street,  Wilshire Ebell Theatre"
3258,https://www.movie-locations.com/movies/d/Death-Becomes-Her-St-James-Episcopal-Church.jpg, the memorial service for Ernest Menville, Midtown Los Angeles, Wilshire Boulevard, Saint James' Episcopal Church
74688,https://www.movie-locations.com/movies/d/Dear-John-Isle-Of-Palms-Fishing-Pier.jpg, John rescues Savannahâs soggy purse, South Carolina, Isle Of Palms, Fishing Pier
2551,https://www.movie-locations.com/movies/d/Dead-Ringers-Trinity-Square.jpg, the apartment of the Mantle twins, Toronto, Trinity Square Park,
2551,https://www.movie-locations.com/movies/d/Dead-Ringers-Casa-Loma.jpg, the elegant restaurant, Toronto, Casa Loma, The Conservatory
1246,https://www.movie-locations.com/movies/d/Dead-Poets-Society-Everett-Theatre.jpg, Neil plays Puck, Delaware, Middletown," West Main Street,  Everett Theatre"
3044,https://www.movie-locations.com/movies/d/../a/Artist-Orpheum-Theatre.jpg, Roman Strauss conducts in the concert hall, downtown Los Angeles, 842 South Broadway, Orpheum Theater
3044,https://www.movie-locations.com/movies/d/Dead-Again-High-Tower.jpg, The climax, Los Angeles, Hollywood," High Tower Drive,  High Tower"
3044,https://www.movie-locations.com/movies/d/Doors-Orpheum.jpg, Roman Strauss conducts in the concert hall, downtown Los Angeles, South Broadway, Orpheum Theatre
3044,https://www.movie-locations.com/movies/d/Dead-Again-Shakespeare-Bridge.jpg, Mike Church gets beaten up, Los Angeles, Los Feliz," Franklin Avenue,  Shakespeare Bridge"
3044,https://www.movie-locations.com/movies/d/../n/Nightmare-On-Elm-Street-Los-Angeles-City-Jail.jpg, the jail, Los Angeles, Lincoln Heights," North Avenue 19,  Lincoln Heights Jail"
4416,https://www.movie-locations.com/movies/d/Day-The-Earth-Caught-Fire-Daily-Express-Building.jpg, the newspaper office, London EC4, Fleet Street, Daily Express Building
7217,https://www.movie-locations.com/movies/d/Dark-Passage-Montgomery-Street.jpg, Irene Jansen’s impossibly stylish pad, San Francisco, Montgomery Street, Malloch Building
7217,https://www.movie-locations.com/movies/d/Dark-Passage-Montgomery-Street-entrance.jpg, the entrance to Irene Jansen’s impossibly stylish pad, San Francisco, Montgomery Street, Malloch Building
7217,https://www.movie-locations.com/movies/d/Dark-Passage-Kearny-Street.jpg, Parry makes his way to an appointment with the plastic surgeon, San Francisco, Kearny Street, Peter Macchiarini Steps
7217,https://www.movie-locations.com/movies/d/Dark-Passage-Filbert-Street-steps-top.jpg, Parry laboriously climbs up to Irene's apartment, San Francisco, Filbert Street Steps,
7217,https://www.movie-locations.com/movies/d/Dark-Passage-Tamalpais-Building.jpg, Parry escapes down the fire escape after Madge plummets to her death, San Francisco, Russian Hill," Greenwich Street,  Tamalpais Building"
91529,https://www.movie-locations.com/movies/d/Dark-Knight-Rises-Osterley-entrance.jpg, Selina Kyle infiltrates ‘Wayne Manor’, London, Osterley," Osterley Park,  Entrance Hall"
91529,https://www.movie-locations.com/movies/d/Dark-Knight-Rises-Wollaton-Hall.jpg, the exterior of ‘Wayne Manor’, Nottingham, Wollaton Hall,
91529,https://www.movie-locations.com/movies/d/Dark-Knight-Rises-Osterley-gallery.jpg, Selina Kyle robs Bruce Wayne and makes her escape through the window, London, Osterley," Osterley Park,  Long Gallery"
91529,https://www.movie-locations.com/movies/d/Dark-Knight-Rises-Osterley-House-staircase.jpg, Alfred threatens to leave ‘Wayne Manor’, London, Osterley," Osterley Park,  Great Stair"
91529,https://www.movie-locations.com/movies/d/Dark-Knight-Rises-Trump-Tower.jpg, the entrance to ‘Wayne Enterprises’, New York, 725 Fifth Avenue, Trump Tower
91529,https://www.movie-locations.com/movies/d/../m/Mission-Impossible-Rogue-Nation-Farmiloe-Building.jpg, ‘Gotham City Police Station’, London EC1, Clerkenwell," 28-36 St John Street,  The Farmiloe Building"
91529,https://www.movie-locations.com/movies/d/Dark-Knight-Rises-JP-Morgan-Building.jpg, the exterior of ‘Gotham Stock Exchange’, New York, Wall Street, JP Morgan Building
91529,https://www.movie-locations.com/movies/d/Dark-Knight-Rises-Lebanon-Street.jpg, the cornered 'flying bat' roars out of the side street, Downtown Los Angeles, Lebanon Street,
91529,https://www.movie-locations.com/movies/d/Dark-Knight-Rises-Stansted-Airport.jpg, Selina Kyle is picked up at ‘Gotham International Airport’, Essex, Stansted Airport,
91529,https://www.movie-locations.com/movies/d/Dark-Knight-Rises-South-3rd-Street.jpg, Blake discovers what’s really going on at the ‘Broucek Cement Company’, Pittsburgh, South 3rd Street, Frank Bryan Cement Plant
91529,https://www.movie-locations.com/movies/d/Dark-Knight-Rises-Heinz-Field.jpg, the home of the ‘Gotham Rogues’, Pittsburgh, Art Rooney Avenue, Heinz Field
91529,https://www.movie-locations.com/movies/d/Dark-Knight-Rises-Carnegie-Mellon-University.jpg, Bane reads out Commissioner Gordon’s speech, Pittsburgh, Fifth Avenue, Carnegie Mellon Institute
91529,https://www.movie-locations.com/movies/d/Dark-Knight-Rises-South-Dithridge-Street.jpg, the entrance to ‘Blackgate Prison’, Pittsburgh, South Dithridge Street, Software Engineering Institute
91529,https://www.movie-locations.com/movies/d/Dark-Knight-Rises-Union-Station.jpg, Dr Crane presides over the kangaroo court, downtown Los Angeles, South Alameda Street, Union Station
91529,https://www.movie-locations.com/movies/d/../s/Seven-Spring-Street-int.jpg, Blake meets up with Lucius Fox, downtown Los Angeles, 650 South Spring Street, Bank Building
91529,https://www.movie-locations.com/movies/d/../c/Constantine-Hoff-Building.jpg," amid the anarchy, Gothamites queue up for emergency supplies", Downtown Los Angeles, East 5th Street, Hoff Building
91529,https://www.movie-locations.com/movies/d/Dark-Knight-Rises-Mehrenghar-Fort.jpg, Bruce Wayne escapes the underground prison, India, Jodhpur, Mehrengarh Fort
91529,https://www.movie-locations.com/movies/d/Dark-Knight-Rises-Trinity-Cathedral.jpg,  ‘St Swithin’s’ orphanage, Pittsburgh, Oliver Avenue, Trinity Cathedral
91529,https://www.movie-locations.com/movies/d/Dark-Knight-Rises-South-Grand Avenue.jpg, the truck carrying the bomb plunges to a lower level roadway, Downtown Los Angeles, South Grand Avenue,
91529,https://www.movie-locations.com/movies/d/Dark-Knight-Rises-Henrhyd-Falls.jpg, John Blake makes a discovery at the waterfall, South Wales, Brecon Beacons, Henrhyd Falls
58559,https://www.movie-locations.com/movies/d/Dark-Knight-Twin-Anchors.jpg," Harvey Dent, barman", Chicago, 1665 North Sedgwick Street, the Twin Anchors
58559,https://www.movie-locations.com/movies/d/Dark-Knight-Chicago-Post-Office-Building.jpg, the Joker’s crew robs ‘Gotham National Bank’, Chicago, West Van Buren Street, Chicago Post Office Building
58559,https://www.movie-locations.com/movies/d/Dark-Knight-200-West-Randolph-Street.jpg, taking down the Scarecrow, Chicago, 200 West Randolph Street,
58559,https://www.movie-locations.com/movies/d/Dark-Knight-Daley-Centre.jpg, the HQ of ‘Wayne Enterprises’, Chicago, Washington Street," Daley Plaza,  Richard J Daley Center"
58559,https://www.movie-locations.com/movies/d/Dark-Knight-IBM-Building.jpg," the offices of Harvey Dent, the Police Commissioner,  and the Mayor plus the boardroom of ‘Wayne Enterprises’", Chicago, 330 North Wabash Avenue, IBM Building
58559,https://www.movie-locations.com/movies/d/Dark-Knight-Criterion.jpg, Rachel enjoys a meal with Harvey Dent, London W1, 224 Piccadilly, Criterion Restaurant
58559,https://www.movie-locations.com/movies/d/Dark-Knight-Chicago-Theatre.jpg, the ballet is cancelled, Chicago, 175 North State Street, Chicago Theater
58559,https://www.movie-locations.com/movies/d/Dark-Knight-Berghoff-Restaurant-ext.jpg, arresting Gotham’s mob bosses, Chicago, 17 West Adams Street, The Berghoff
58559,https://www.movie-locations.com/movies/d/Dark-Knight-Illinois-Center.jpg, The Joker crashes Harvey Dentâs fundraiser, Chicago, 111 East Wacker Drive, Illinois Center Buildings
58559,https://www.movie-locations.com/movies/d/Dark-Knight-Hotel-71.jpg, Bruce Wayneâs penthouse, Chicago, 71 East Wacker Drive, Hotel 71
58559,https://www.movie-locations.com/movies/d/Dark-Knight-Willis-Tower.jpg, The Dark Knight surveys Gotham, Chicago, Sears Tower,
58559,https://www.movie-locations.com/movies/d/../m/Mission-Impossible-Rogue-Nation-Farmiloe-Building.jpg, the interior of ‘Gotham Police Station’, London EC1, Clerkenwell," 28-36 St John Street,  The Farmiloe Building"
58559,https://www.movie-locations.com/movies/d/Dark-Knight-Millennium-Park-Metra-Station.jpg, the Batpod chase, Chicago, Millennium Park, Metra station
58559,https://www.movie-locations.com/movies/d/Dark-Knight-La-Salle-Street.jpg, the confrontation between Batman and the Joker, Chicago, South LaSalle Street,
58559,https://www.movie-locations.com/movies/d/Dark-Knight-Lake-Street.jpg, Bruce Wayne in the Lamborghini, Chicago, Lake Street,
58559,https://www.movie-locations.com/movies/d/Dark-Knight-Twin-Anchors-bartop.jpg, Harvey’s dents, Chicago, 1665 North Sedgwick Street, bar at the Twin Anchors
58559,https://www.movie-locations.com/movies/d/Dark-Knight-Navy-Pier.jpg, the evacuation of Gotham, Chicago, Navy Pier,
58559,https://www.movie-locations.com/movies/d/Dark-Knight-Trump-Tower.jpg, the climactic hand-to-hand face-off between Batman and the Joker, Chicago, North Wabash Avenue, Trump Tower
6157,https://www.movie-locations.com/movies/d/Daredevil-Kings-Head.jpg, Bullseye gets the call from Kingpin in the 'English' pub, Los Angeles, Santa Monica, Olde King's Head
6157,https://www.movie-locations.com/movies/d/Daredevil-Arcade-Building.jpg, Matt Murdock’s apartment, Downtown Los Angeles, South Broadway, Arcade Building
6157,https://www.movie-locations.com/movies/d/Daredevil-Millennium-Biltmore-Hotel.jpg, The Black and White Ball, downtown Los Angeles, South Grand Avenue, Millennium Biltmore Hotel
141749,https://www.movie-locations.com/movies/d/Danish-Girl-Nyhavn.jpg, the neighbourhood of Einar and Gerda, Copenhagen, Nyhavn,
141749,https://www.movie-locations.com/movies/d/Danish-Girl-Nyhavn-12.jpg, Einar and Gerda's apartment, Copenhagen, Nyhavn,
141749,https://www.movie-locations.com/movies/d/Danish-Girl-Nyhavn-int.jpg, the entrance to Einar and Gerda's apartment, Copenhagen, Nyhavn,
141749,https://www.movie-locations.com/movies/d/Danish-Girl-Starekassen.jpg, the gilded arch by the theatre, Copenhagen, StÃ¦rekassen,
141749,https://www.movie-locations.com/movies/d/Danish-Girl-Wiltons-Music-Hall.jpg, the Danish Theatre, London, Wilton's Music Hall,
141749,https://www.movie-locations.com/movies/d/Danish-Girl-Suensonsgade-8.jpg, the home of the enigmatic Henrik, Copenhagen, Suensonsgade,
141749,https://www.movie-locations.com/movies/d/Danish-Girl-Princelet-Street.jpg, the interior of Henrik's house, London E1, Spitalfields, Princelet Street
141749,https://www.movie-locations.com/movies/d/Danish-Girl-Frederiksgade.jpg, Einar and Lili's 'Parisian' apartment, Copenhagen, Frederiksgade,
141749,https://www.movie-locations.com/movies/d/../t/Tinker-Tailor-Soldier-Spy-Blythe-House.jpg, Lili escapes from the clinic after the shocking diagnosis, London W14, Blythe Road, Blythe House
141749,https://www.movie-locations.com/movies/d/Danish-Girl-Pergola.jpg, the garden in which Lili recuperates, London NW3, Hampstead," North End Way Road,  Hampstead Heath Pergola"
2020,https://www.movie-locations.com/movies/d/Dangerous-Liaisons-Champs-Sur-Marne.jpg," Chateau Champs-Sur-Marne, Franc", France, Chateau Champs-Sur-Marne,
2020,https://www.movie-locations.com/movies/d/Dangerous-Liaisons-Chateau-De-Vincennes.jpg," Chateau de Vincennes, Vincennes, Franc", France, Vincennes, Chateau de Vincennes
590,https://www.movie-locations.com/movies/d/Dances-With-Wolves-Spearfish-Canyon.jpg, the winter camp, South Dakota, Spearfish Canyon,
6961,https://www.movie-locations.com/movies/d/Damage-Kynance-Mews-SW7.jpg, Anna Barton’s London flat, London SW7, South Kensington, Kynance Mews
6961,https://www.movie-locations.com/movies/d/Damage-Manchester-Town-Hall.jpg, the ‘Houses of Parliament’, Manchester, Albert Square, Manchester Town Hall
6338,https://www.movie-locations.com/movies/d/Daddy-Day-Care-Congress-Place.jpg, the Day Care house, Pasadena, Congress Place,
42900,https://www.movie-locations.com/movies/c/Cul-De-Sac-Lindisfarne-Castle.jpg, The remote 'Rob Roy' castle, Northumberland, Holy Island, Lindisfarne Castle
1094,https://www.movie-locations.com/movies/c/Crying-Game-Coronet-Street-2018.jpg, The exterior of the fictitious ‘Metro Bar’, London N1, Hoxton, Coronet Street
1094,https://www.movie-locations.com/movies/c/Crying-Game-Fournier-Street.jpg, Dil’s hairdressing salon, E1, Spitalfields, Fournier Street
1094,https://www.movie-locations.com/movies/c/Crying-Game-Crispin-Street-Refuge.jpg, Fergus’s London digs, E1, Spitalfields, Crispin Street
1094,https://www.movie-locations.com/movies/c/Crying-Game-Mother.jpg, The interior of the fictitious ‘Metro Bar’," London
N1", Hoxton," 333 Old Street,  Mother"
1094,https://www.movie-locations.com/movies/c/Crying-Game-Hoxton-Square.jpg, Dil’s flat, London N1, Hoxton, 8-9 Hoxton Square
1094,https://www.movie-locations.com/movies/c/Crying-Game-Preem-And-Prithi.jpg, Jude spies on Dil and Fergus in the restaurant, London E1, Brick Lane, Prithi
249540,https://www.movie-locations.com/movies/c/Cruella-Liberty.jpg, the department store, London SW1, Great Marlborough Street, Liberty
249540,https://www.movie-locations.com/movies/c/../x/X-Men-First-Class-Englefield-House.jpg," 'Hellman Hall', the estate of the Baroness",-,-, Englefield House
249540,https://www.movie-locations.com/movies/c/Cruella-Greenwich-Fountain.jpg, Estella arrives at the fountain in 'Regent's Park', London SE10, Greenwich, Old Royal Naval College
249540,https://www.movie-locations.com/movies/c/Cruella-Greenwich-Park.jpg, Estella and her two new friends are chased out of 'Regent's Park', London SE10, Greenwich," ,  Greenwich Park"
