movieId,lucationUrl,locationRef,city/country,area/street,location
5810,https://www.movie-locations.com/movies/0/8-Mile-Schultes-Avenue.jpg, Rabbitâs trailer home north of 8 Mile Road, Detroit, Warren, Schultes Avenue
5810,https://www.movie-locations.com/movies/0/8-Mile-8-Mile-Road.jpg, Rabbit catches the bus at 8 Mile Road, Detroit, Warren, 8 Mile Road at Schultes Avenue
5810,https://www.movie-locations.com/movies/0/8-Mile-East-Milwaukee-Street.jpg, Rabbit works in the stamping plant, Detroit, East Milwaukee Street,
5810,https://www.movie-locations.com/movies/0/8-Mile-30-Clifford-Street.jpg," the exterior of the ‘Shelter’, where Rabbit battles", Detroit, Clifford Street,
5810,https://www.movie-locations.com/movies/0/8-Mile-Michigan-Building.jpg, Three One Third and The Free World face off in the parking garage, Detroit, Bagley Street, Michigan Building
5810,https://www.movie-locations.com/movies/0/8-Mile-Penobscot-Building.jpg, Rabbit visits ‘WJLB’ radio station, Detroit, Griswold Street, Penobscot Building
5810,https://www.movie-locations.com/movies/0/8-Mile-Clifford-Street.jpg, Rabbit walks off to take his chance on the future, Detroit, Clifford Street,
35836,https://www.movie-locations.com/movies/0/40-Year-Old-Virgin-Encino-Courtyard-Mall.jpg," Encino Courtyard Mall, Ventura Boulevard, Ventura, San Fernando Valle", San Fernando Valley, Ventura," Ventura Boulevard,  Encino Courtyard Mall"
35836,https://www.movie-locations.com/movies/0/40-Year-Old-Virgin-Ventura-Boulevard.jpg, Trish's eBay store, San Fernando Valley, Ventura," Ventura Boulevard,  Net2Auction"
35836,https://www.movie-locations.com/movies/0/40-Year-Old-Virgin-Bistro-Garden.jpg," speed-dating at Bistro Garden, Ventura Boulevard, Ventura, San Fernando Valle", San Fernando Valley, Ventura," Ventura Boulevard,  speed-dating at Bistro Garden"
35836,https://www.movie-locations.com/movies/0/40-Year-Old-Virgin-Delmonicos.jpg," the second date, at Delmonico's Lobster House, Ventura Boulevard, Ventura, San Fernando Valle", San Fernando Valley, Ventura," Ventura Boulevard,  at Delmonico's Lobster House,  the second date"
5308,https://www.movie-locations.com/movies/0/3-Men-And-A-Baby-Prasada.jpg, the Manhattan apartment building, New York, Central Park West, The Prasada
2819,https://www.movie-locations.com/movies/t/Three-Days-Of-The-Condor-East-77th-Street.jpg, Joe Turner works at the 'American Historical Literary Society', New York, East Side, East 77th Street
2819,https://www.movie-locations.com/movies/t/Three-Days-Of-The-Condor-Lexington-Candy-Shop.jpg, Turner nips out to get sandwiches, Upper East Side, Lexington Avenue, Lexington Candy Shop Luncheonette
2819,https://www.movie-locations.com/movies/t/Three-Days-Of-The-Condor-Guggenheim-Museum.jpg, Joe Turner hides out in the art gallery, New York, Upper East Side," Fifth Avenue,  Guggenheim Museum"
2819,https://www.movie-locations.com/movies/t/Three-Days-Of-The-Condor-Ansonia-passage.jpg, Higgins sets up the meeting, New York, Upper West Side, Alley behind the Ansonia
2819,https://www.movie-locations.com/movies/t/Three-Days-Of-The-Condor-Ansonia-passage-2.jpg, Turner turns up for the meeting, New York, Upper West Side, Alley behind the Ansonia
2819,https://www.movie-locations.com/movies/t/Three-Days-Of-The-Condor-Ansonia-passage-reverse.jpg, Joe Turner barely escapes with his life, New York, Upper West Side, Alley behind the Ansonia
2819,https://www.movie-locations.com/movies/t/Three-Days-Of-The-Condor-Hoboken-Station.jpg, Joe Turner says his goodbyes to Kathy, New Jersey, Hoboken, Hoboken Railway Station
6502,https://www.movie-locations.com/movies/0/28-Days-Later-Canary-Wharf.jpg, the vast escalators, London, Canary Wharf Station,
6502,https://www.movie-locations.com/movies/i/Into-The-Woods-Waverley-Abbey.jpg, the brief idyll in the countryside, Surrey, Farnham, Waverley Abbey
58803,https://www.movie-locations.com/movies/0/21-Doyles-Braddock-Cafe.jpg, Ben Campbell celebrates his birthday, Jamaica Plain, Washington Street, Doyle's Cafe
58803,https://www.movie-locations.com/movies/0/21-J-Press.jpg, Ben gets a job at the tailor’s to fund his college fees, Cambridge, Mount Auburn Street, J Press
58803,https://www.movie-locations.com/movies/0/21-South-Street-Diner.jpg, the team explains the set-up to the newbie, Boston, Kneeland Street, South Street Diner
58803,https://www.movie-locations.com/movies/0/21-Tyler-Street.jpg, Ben Campbell searches for the location of the trial run, Boston, Chinatown, Tyler Street
58803,https://www.movie-locations.com/movies/0/21-Beach-Street.jpg, Ben Campbell finds the location of the trial run, Boston, Chinatown, Beach Street
58803,https://www.movie-locations.com/movies/0/21-Peoples-Republik.jpg, Ben buys Jill a drink in the student bar, Cambridge, Massachusetts Avenue, People’s Republik
58803,https://www.movie-locations.com/movies/0/21-Beacon-Street.jpg," Broke, Ben visits Jill", Chelsea, Beacon Street,
924,https://www.movie-locations.com/movies/0/2001-Spitzkoppe.jpg, ‘The Dawn Of Man’, Namibia, Spitzkoppe,
6383,https://www.movie-locations.com/movies/0/2-Fast-2-Furious-Mana.jpg, the police stake-out is foiled by the sudden appearance of a fleet of cars, Miami, NW 5th Avenue, Mana Wynwood Production Village
222477,https://www.movie-locations.com/movies/0/1984-Senate-House.jpg, the Ministry of Truth, London WC1, Bloomsbury," Malet Street,  Senate House"
222477,https://www.movie-locations.com/movies/0/1984-Roundway-Hill.jpg, the 'Golden Country', Wiltshire, Devizes, Roundway Hill
208703,https://www.movie-locations.com/movies/0/1917-Erlestoke-final-tree.jpg, the lone tree by the field hospital, Wiltshire, Erlestoke, Pear Tree Hill
208703,https://www.movie-locations.com/movies/0/1917-Salisbury-Plain.jpg, the countryside of 'Northern France', Wiltshire, Salisbury Plain,
208703,https://www.movie-locations.com/movies/0/1917-Erlestoke-opening-scene.jpg, Blake and Schofield are woken up at the beginning of the film, Wiltshire, Erlestoke, Pear Tree Hill
208703,https://www.movie-locations.com/movies/0/1917-Erlestoke-opening-scene-trench.jpg, Blake and Schofield walk down into the trench for their orders, Wiltshire, Erlestoke, Pear Tree Hill
53953,https://www.movie-locations.com/movies/0/1408-Reform-Club.jpg, the lobby of the fictitious 'Dolphin Hotel', London SW1, Pall Mall, The Reform Club
53953,https://www.movie-locations.com/movies/0/../d/Dictator-Roosevelt-Hotel.jpg, entrance to the fictitious 'Dolphin Hotel', New York, East 45th Street, The Roosevelt Hotel
7444,https://www.movie-locations.com/movies/0/13-Going-On-30-Spruce-Street-Pasadena.jpg," the ""New Jersey"" homes of Jenna and Matt", California, South Pasadena, Spruce Street
7444,https://www.movie-locations.com/movies/t/Transformers-Marshall-School.jpg," Jenna and Matt's ""New Jersey"" school", Pasadena, Allen Avenue, Marshall School
7444,https://www.movie-locations.com/movies/0/13-Going-On-30-Fifth-Avenue.jpg, adult Jenna's smart Manhattan apartment', Manhattan, Fifth Avenue,
7444,https://www.movie-locations.com/movies/0/13-Going-On-30-4th-Street-Greenwich-Village.jpg, adult Matt's Greenwich Village apartment', New York, Greenwich Village, 4th Street
7444,https://www.movie-locations.com/movies/0/../h/Highlander-Greene-Street.jpg, the cocktail party, Manhattan, Greene Street in SoHo,
7444,https://www.movie-locations.com/movies/0/../g/Ghostbusters-New-York-Public-Library.jpg, the 'Class of 2004' photoshoot, New York, Fifth Avenue, New York Public Library
7444,https://www.movie-locations.com/movies/0/13-Going-On-30-Fletcher-Avenue-Pasadena.jpg, Jenna and Matt move into their married home, California, South Pasadena, Fletcher Avenue
81562,https://www.movie-locations.com/movies/0/127-Hours-Blue-John-Canyon.jpg, trapped in the canyon, Utah, Canyonlands National Park, Bluejohn Canyon
105844,https://www.movie-locations.com/movies/0/12-Years-A-Slave-Felicity.jpg, Solomon spends years on the Epps plantation, Louisiana, Vacherie, Felicity Plantation
32,https://www.movie-locations.com/movies/0/12-Monkeys-Engineers-Club.jpg, The elegant home of Dr Goines, Baltimore, West Mount Vernon Place, Garrett Jacobs Mansion
32,https://www.movie-locations.com/movies/0/12-Monkeys-Senator.jpg, Cole and Railly sit through a 24-hour Hitchcock Fest, Baltimore, York Road, Senator Theatre
1203,https://www.movie-locations.com/movies/0/12-Angry-Men-New-York-County-Courthouse.jpg, the courthouse setting, New York, New York County Courthouse,
1367,https://www.movie-locations.com/movies/0/101-Dalmatians-Minster-Crt.jpg, the ‘House of DeVil’, London EC3, Mincing Lane, Minster Court
1367,https://www.movie-locations.com/movies/0/101-Dalmatians-St-Lukes-Church.jpg, doggies patiently wait outside as Roger and Anita get married, Chelsea SW3, Sydney Street, Parish Church Of St Luke
2572,https://www.movie-locations.com/movies/0/10-Things-I-Hate-Stadium-High.jpg, ‘Padua High’, Tacoma, North E Street, Stadium High School
6658,https://www.movie-locations.com/movies/0/10-All-Saints-Episcopal-Church.jpg, George first claps eyes on Jenny, Beverly Hills , Camden Drive, All Saints Episcopal Church
4816,https://www.movie-locations.com/movies/z/Zoolander-Greene-Street.jpg, the apartment of Derek Zoolander and his model chums, New York, SoHo, Greene Street
4816,https://www.movie-locations.com/movies/z/Zoolander-Westin-Bonaventure.jpg, Zoolander is too quick to accept the award, downtown Los Angeles, South Figueroa Street, Westin Bonaventure Hotel
4816,https://www.movie-locations.com/movies/z/Zoolander-Gas-Station.jpg, Derek Zoolander’s chums enjoy a playful petrol fight, New York, West Broadway at Varrick Street,
4816,https://www.movie-locations.com/movies/z/Zoolander-26-Broadway.jpg, Mugatu’s inspired ‘Derelicte’ show, New York, Broadway,
71535,https://www.movie-locations.com/movies/z/Zombieland-Wild-Adventures-Valdosta.jpg, Wichita and Little Rock arrive at 'Pacific Playground', Georgia, Valdosta," Wild Adventures,  Firecracker"
71535,https://www.movie-locations.com/movies/z/Zombieland-Firecracker-Wild-Adventures.jpg, Wichita and Little Rock are stranded on the funfair ride, Georgia, Valdosta," Wild Adventures,  Firecracker"
109187,https://www.movie-locations.com/movies/z/Zero-Theorem-Romanian-Athenaeum-int.jpg, Qohenâs workplace at âMancomâ, Romania, Bucharest, the lobby of the Romanian Athenaeum
109187,https://www.movie-locations.com/movies/z/Zero-Theorem-Romanian-Athenaeum-ext.jpg, Qohenâs workplace at âMancomâ, Romania, Bucharest, exterior of the Romanian Athenaeum
109187,https://www.movie-locations.com/movies/z/Zero-Theorem-Carol-Park-Memorial.jpg, Bob takes Qohen for a break in the park, Romania, Bucharest," Carol Park,  Communist Memorial"
8189,https://www.movie-locations.com/movies/z/Zazie-Dans-Le-Metro_Bonne-Nouvelle.jpg, the basement âSalle de Reunionsâ bar, Paris, Rue Notre Dame de Bonne Nouvelle,
8189,https://www.movie-locations.com/movies/z/Zazie-St-Vincent-De-Paul.jpg, Gabriel points out the strangely identical tourist sights, Paris, rue La Fayette, Church of St Vincent de Paul
8189,https://www.movie-locations.com/movies/z/Zazie-Dans-Le-Metro_Bonne-Nouvelle-2.jpg, the basement âSalle de Reunionsâ bar, Paris, Rue Notre Dame de Bonne Nouvelle,
8189,https://www.movie-locations.com/movies/z/Zazie-Dans-Le-Metro-Galerie-Vivienne.jpg, the chase through the shopping arcade, Paris, Galerie Vivienne,
8189,https://www.movie-locations.com/movies/z/Zazie-Villa-Des-Platanes.jpg, chasing around the staircase, Paris, Boulevard de Clichy, Villa des Platanes
8189,https://www.movie-locations.com/movies/z/Zazie-Port-De-Suffren.jpg, Gabriel is abducted by buxom young women, Paris, Port de Suffren,
8189,https://www.movie-locations.com/movies/z/Zazie-club-staircase.jpg, the steps leading up to 'Le Paradis', Paris, rue La Fayette,
8189,https://www.movie-locations.com/movies/z/Zazie-club-passage.jpg, the passageway leading  to 'Le Paradis', Paris, rue La Fayette,
40851,https://www.movie-locations.com/movies/z/Zathura-Oaklawn-Avenue-Pasadena.jpg, the space-bound house, California, South Pasadena, Oaklawn Avenue
62434,https://www.movie-locations.com/movies/z/../d/Dawn-Of-The-Dead-Monroeville-Mall.jpg, Zack finds a producer, Pennsylvania, Monroeville, Monroeville Mall
26237,https://www.movie-locations.com/movies/z/Zabriskie-Point-1.jpg, out in the desert, California, Death Valley, Zabriskie Point
26237,https://www.movie-locations.com/movies/z/Zabriskie-Point-2.jpg, out in the desert, California, Death Valley, Zabriskie Point
26237,https://www.movie-locations.com/movies/z/Zabriskie-Point-overlook.jpg, out in the desert, California, Death Valley, Zabriskie Point Lookout
2424,https://www.movie-locations.com/movies/y/Youve-Got-Mail-69th-Street.jpg, the little independent bookstore, New York, West Side, West 69th Street
2424,https://www.movie-locations.com/movies/y/Youve-Got-Mail-Cafe-Lalo.jpg, Kathleen waits to meet ‘NY152’, New York, Upper West Side," West 83rd Street,  Cafe Lalo"
68269,https://www.movie-locations.com/movies/y/Young-Victoria-Ham-House.jpg, the princess grows up in ‘Kensington Palace’, London, Richmond, Ham House
68269,https://www.movie-locations.com/movies/y/../h/Hamlet-1996-Blenheim-Palace.jpg, the ‘newly completed Buckingham Palace’, Oxfordshire, Woodstock, Blenheim Palace
68269,https://www.movie-locations.com/movies/y/../m/Music-Lovers-Wilton-House.jpg," Albert’s home, ‘Rosenau Castle, Coburg’", Wiltshire, Wilton, Wilton House
68269,https://www.movie-locations.com/movies/y/Young-Victoria-Arundel-Castle.jpg, ‘Windsor Castle’, West Sussex, Arundel Castle,
68269,https://www.movie-locations.com/movies/y/../r/Reds-Lancaster-House.jpg, the Coronation Ball at ‘Buckingham Palace’, London, St James's, Lancaster House
68269,https://www.movie-locations.com/movies/y/../k/King-Ralph-Belvoir-Castle.jpg, ‘Buckingham Palace’ interiors, Leicestershire, near Grantham, Belvoir Castle
157045,https://www.movie-locations.com/movies/y/Young-Stranger-North-Catalina-Street.jpg, Jerry's house, Los Angeles, Los Feliz, North Catalina Street
157045,https://www.movie-locations.com/movies/y/Young-Stranger-Bruin-Cinema.jpg, Hal gets into a ruckus with the cinema manager, Los Angeles, Westwood," Broxton Avenue,  Fox Bruin Theater"
157045,https://www.movie-locations.com/movies/y/../b/Buffy-The-Vampire-Slayer-John-Marshall-High-School.jpg, Hal attends 'Ulysses S Grant High School', Los Angeles, Silverlake, John Marshall High School
2414,https://www.movie-locations.com/movies/y/../k/King-Ralph-Belvoir-Castle.jpg, Waxflatter demonstrates his flying machine, Leicestershire, near Grantham, Belvoir Castle
7569,https://www.movie-locations.com/movies/y/You-Only-Live-Twice-Himeji-Castle.jpg, the Ninja training school, Japan, Himeji Castle,
7569,https://www.movie-locations.com/movies/y/You-Only-Live-Twice-Hotel-New-Otani.jpg, the headquarters of âOsato Chemicals and Engineering Companyâ, Tokyo, Chiyoda-Ku," Kioi-cho,  Hotel New Otani Tokyo"
841,https://www.movie-locations.com/movies/y/Yeux-Sans-Visage-Barrage-De-Noisiel.jpg, Louise disposes of a body in the 'Seine', France, Noisiel," River Marne,  Barrage de Noisiel"
3329,https://www.movie-locations.com/movies/y/Year-My-Voice-Broke-Braidwood-Hotel.jpg, the hotel, New South Wales, Braidwood," Wallace Street,  Braidwood Hotel"
111362,https://www.movie-locations.com/movies/x/X-Men-Days-Of-Future-Past-Hotel-De-Ville.jpg, peace talks at the âParisâ hotel, Montreal, Hotel de Ville,
111362,https://www.movie-locations.com/movies/x/X-Men-2-Hatley-Castle.jpg, ‘Professor Xavier’s academy’ in ‘Westchester’, Vancouver, Hatley Castle,
111362,https://www.movie-locations.com/movies/x/X-Men-Days-Of-Future-Past-Fontaine-Place-Vauquelin.jpg, peace talks at the âParisâ hotel, Montreal, Hotel de Ville,
87232,https://www.movie-locations.com/movies/x/X-Men-First-Class-Englefield-House.jpg, The schoolroom of ‘Xavier’s academy’,-,-, Englefield House
87232,https://www.movie-locations.com/movies/x/../a/Absolute-Beginners-Cafe-De-Paris.jpg," the 'Hellfire Club, Las Vegas'", London W1, Coventry Street, Cafe De Paris (now closed)
87232,https://www.movie-locations.com/movies/x/../m/Music-Lovers-West-Wycombe-House.jpg, the ‘Russian’ military retreat, Buckinghamshire, West Wycombe, West Wycombe House
87232,https://www.movie-locations.com/movies/x/../h/Harry-Potter-Philosophers-Stone-Australia-House.jpg, The ‘Kremlin’ war room, London WC2, Strand, Australia House
68319,https://www.movie-locations.com/movies/x/X-Men-Origins-Wolverine-Stirling-Falls.jpg, Wolverine escapes from the ‘Alkali Lake’ facility, New Zealand, Milford Sound, Stirling Falls
68319,https://www.movie-locations.com/movies/x/X-Men-Origins-Wolverine-Buchanan-Building.jpg, the raid on the ‘Lagos’ compound, Vancouver, University of British Columbia, Buchanan Tower
68319,https://www.movie-locations.com/movies/x/X-Men-Origins-Wolverine-Homebush-Cinema.jpg, the Blob trains in John Wraith’s ‘Las Vegas’ gym, Sydney, Homebush," Parramatta Road,  Homebush Cinema"
45499,https://www.movie-locations.com/movies/x/X-Men-The-Last-Stand-Alouette-Lake.jpg, Phoenix rises from ‘Alkali Lake’, British Columbia, Golden Ears Provincial Park, Alouette Lake
122924,https://www.movie-locations.com/movies/x/X-Men-Apocalypse-Corona-Theatre.jpg, Angel is pitted against Nightcrawler in the âEast Berlinâ fight club, MontrÃ©al, Notre-Dame St West, Corona Theatre
122924,https://www.movie-locations.com/movies/x/X-Men-2-Hatley-Castle.jpg, ‘Professor Xavier’s academy’ in ‘Westchester’, Vancouver, Hatley Castle,
122924,https://www.movie-locations.com/movies/x/X-Men-2-St-Andrews-Wesley-Church.jpg, the 'Boston' church in which Nightcrawler is discovered, Vancouver, Nelson Street, St Andrewâs Wesley Church
53125,https://www.movie-locations.com/movies/w/Worlds-End-Gardeners-Arms-Letchworth.jpg," ultimate destination, ‘The World’s End’ pub", Letchworth Garden City, Wilbury Hills Road, Gardeners Arms
53125,https://www.movie-locations.com/movies/w/Worlds-End-roundabout.jpg, the roundabout at ‘Newton Haven’, Letchworth Garden City, Broadway, Sollershott Circus
53125,https://www.movie-locations.com/movies/w/Worlds-End-Pear-Tree.jpg, Pub No. 1 – ‘The First Post’, Welwyn Garden City, Hollybush Lane, The Peartree
53125,https://www.movie-locations.com/movies/w/Worlds-End-Doctors-Tonic.jpg, Pub No. 2 – ‘The Old Familiar ’, Welwyn Garden City, Church Road, The Doctor’s Tonic
53125,https://www.movie-locations.com/movies/w/Worlds-End-The-Cork.jpg, Pub No. 3 ‘The Famous Cock’, Welwyn Garden City, The Two Willows (formerly The Cork),
53125,https://www.movie-locations.com/movies/w/Worlds-End-Parkway-Bar.jpg, Pub No. 4 – ‘The Cross Hands’, Welwyn Garden City, Parkway, The Parkway Bar
53125,https://www.movie-locations.com/movies/w/Worlds-End-Leys-Avenue.jpg, Pub No. 5 – ‘The Good Companions’, Letchworth Garden City, 71 Leys Avenue,
53125,https://www.movie-locations.com/movies/w/Worlds-End-Wenlock.jpg, Pub No. 5 – ‘The Good Companions’ – inside, London, Islington, Wenlock Arms
53125,https://www.movie-locations.com/movies/w/Worlds-End-Three-Magnets.jpg, Pub no. 6 – ‘The Trusty Servant’, Letchworth Garden City, Leys Avenue, The Three Magnets
53125,https://www.movie-locations.com/movies/w/Worlds-End-Colonnade.jpg, Pub No. 7 – ‘The Two-Headed Dog’, Letchworth Garden City, The Colonnade,
53125,https://www.movie-locations.com/movies/w/Worlds-End-Broadway-Cinema.jpg, Pub No. 8 – ‘The Mermaid’, Letchworth Garden City, Broadway Cinema,
53125,https://www.movie-locations.com/movies/w/Worlds-End-Thai-Garden.jpg, Pub No. 9 – ‘The Beehive’, Letchworth Garden City, Gernon Road, Thai Garden
53125,https://www.movie-locations.com/movies/w/Worlds-End-bowling-green.jpg, lying low in the ‘smoke house’, Letchworth Garden City, Norton Way South, Howard Garden Social Centre
53125,https://www.movie-locations.com/movies/w/Worlds-End-Arena-Tavern.jpg, Pub No. 10 – ‘The King’s Head ’, Letchworth Garden City, Arena Parade, The Arena Tavern
53125,https://www.movie-locations.com/movies/w/Worlds-End-Letchworth-Station.jpg, nearly there – Pub No. 11 – ‘The Hole In The Wall’, Letchworth Garden City, Letchworth Garden City Railway Station,
103249,https://www.movie-locations.com/movies/w/World-War-Z-George-Square-Glasgow.jpg, zombies overrun the ‘Philadelphia’ square, Glasgow, George Square,
103249,https://www.movie-locations.com/movies/w/../m/Midnight-Express-Fort-St-Elmo.jpg, panicked crowds in 'Jerusalem', Malta, Valletta, Fort St Elmo
103249,https://www.movie-locations.com/movies/w/World-War-Z-Lulworth.jpg, the safe zone in ‘Nova Scotia’, Dorset, Lulworth Cove,
3082,https://www.movie-locations.com/movies/w/World-Is-Not-Enough-Bilbao.jpg, the opening teaser, Bilbao, Guggenheim Museum,
3082,https://www.movie-locations.com/movies/w/World-Is-Not-Enough-Vauxhall-Cross.jpg, MI6 HQ on the Thames,-,-, Vauxhall Cross
3082,https://www.movie-locations.com/movies/w/World-Is-Not-Enough-Glengall-Bridge.jpg, ducking under the bridge, Millwall Inner Dock, Glengall Bridge,
3082,https://www.movie-locations.com/movies/w/../h/Highlander-Eilean-Donan-Castle.jpg, MI6 HQ ‘Castle Thane’, Scotland, Dornie, Eilean Donan Castle
3082,https://www.movie-locations.com/movies/w/World-Is-Not-Enough-Maidens-Tower.jpg, M is imprisoned, Istanbul, the Bosphorus, Maiden’s Tower
2245,https://www.movie-locations.com/movies/w/../a/Arthur-1981-Carnegie-Mansion.jpg," the ‘Union Club’, site of the Trask wedding reception", New York, East Side, 1 East 91st Street
2245,https://www.movie-locations.com/movies/w/../a/Amazing-Spider-Man-Customs-House.jpg, the offices of the ‘Trask Company’, Lower Manhattan, Broadway at Bowling Green, National Museum of the Native American - previously the old US Customs House
2245,https://www.movie-locations.com/movies/w/../a/Anderson-Tapes-91st-Street.jpg, the Trask reception, New York, East Side, 1 East 91st Street
143355,https://www.movie-locations.com/movies/w/Wonder-Woman-Matera.jpg, the streets of 'Themyscira', Italy, Basilicata, Matera
143355,https://www.movie-locations.com/movies/w/Wonder-Woman-Louvre-Pyramid.jpg, the Wayne Enterprises vehicle delivers a briefcase, Paris, Louvre,
143355,https://www.movie-locations.com/movies/w/../b/Beat-The-Devil-Villa-Cimbrone.jpg, the seafront terrace of 'Themyscira', Italy, Ravello," Villa Cimbrone,  Terrace Of Infinity"
143355,https://www.movie-locations.com/movies/w/Wonder-Woman-Stone-Buildings-2018.jpg, Diana and Steve arrive in London, London WC2, Lincoln's Inn Fields, Stone Buildings
143355,https://www.movie-locations.com/movies/w/../h/Harry-Potter-Philosophers-Stone-Australia-House.jpg, The interior of ‘Selfridge & Co’ department store, London WC2, Strand, Australia House
143355,https://www.movie-locations.com/movies/w/Wonder-Woman-Victoria-House.jpg, the exterior of ‘Selfridge & Co’ department store, London, Bloomsbury Square, Victoria House
143355,https://www.movie-locations.com/movies/w/Wonder-Woman-Sicilian-Avenue-entrance.jpg, leaving the department store, London, Sicilian Avenue,
143355,https://www.movie-locations.com/movies/w/Wonder-Woman-Sicilian-Avenue.jpg, Steve becomes aware of German agents, London, Sicilian Avenue,
143355,https://www.movie-locations.com/movies/w/Wonder-Woman-Arundel-Castle.jpg, the German High Command at the 'Belgian chateau', West Sussex, Arundel, Arundel Castle
143355,https://www.movie-locations.com/movies/w/Wonder-Woman-Long-Gallery-Hatfield-House.jpg, the gala in the 'Belgian chateau', Hertfordshire, Hatfield," Hatfield House,  Long Gallery"
6247,https://www.movie-locations.com/movies/w/Women-In-Love-Kedleston-Hall.jpg, Hermione’s grand home, Derbyshire, Kedleston Hall,
6247,https://www.movie-locations.com/movies/w/Women-In-Love-Matlock.jpg, the Brangwen house, Derbyshire, Matlock, 80 New Street
6247,https://www.movie-locations.com/movies/w/Women-In-Love-St-Giles.jpg, the Crich wedding, Derbyshire, Matlock," Church Street,  St Giles’ Church"
6247,https://www.movie-locations.com/movies/w/Women-In-Love-Elvaston.jpg," ‘Shortlands’, the Crich family house", Derbyshire, Elvaston Castle,
3996,https://www.movie-locations.com/movies/c/Crouching-Tiger-Hidden-Dragon-Mount-Cangyan.jpg, the temple at ‘Mount Wudang’, China, Mount Cangyan,
3996,https://www.movie-locations.com/movies/c/Crouching-Tiger-Hidden-Dragon-Hongcunzhen.jpg, Li Mu Bai arrives in the village with the Green Destiny, China, Hongcunzhen Village,
919,https://www.movie-locations.com/movies/w/Sony-Pictures.jpg, visit the filming site in Culver City, Culver City, Madison Street, Sony Pictures Plaza
919,https://www.movie-locations.com/movies/w/Wizard-Of-Oz-Culver-Hotel.jpg,,-,-,y
1202,https://www.movie-locations.com/movies/w/Withnail-And-I-Sleddale-Hall.jpg, ‘Crow Cragg’, Cumbria, Shap, Sleddale Hall
1202,https://www.movie-locations.com/movies/w/Withnail-And-I-Chepstow-Road-steps.jpg, the 'Camden' flat steps â seen in the publicity still, London W2, Bayswater, Chepstow Place
1202,https://www.movie-locations.com/movies/w/Withnail-And-I-Chepstow-Road.jpg, the 'Camden' flat, London W2, Bayswater, Chepstow Place
1202,https://www.movie-locations.com/movies/w/Withnail-And-I-Tavistock-Crescent.jpg," The ‘Mother Black Cap, Camden’ – replaced by flats", London, Westbourne Park, Tavistock Crescent
1202,https://www.movie-locations.com/movies/w/Withnail-&-I-Fudruckers.jpg," The ‘Mother Black Cap, Camden’", London, Westbourne Park," Tavistock Crescent,  as it was in the mid-Nineties,  Fudruckers (since demolished)"
1202,https://www.movie-locations.com/movies/w/Withnail-And-I-Glebe-Place.jpg, Uncle Monty’s London house, London SW3, Chelsea, Glebe Place
