movieId,lucationUrl,locationRef,city/country,area/street,location
1291,https://www.movie-locations.com/movies/i/Indiana-Jones-And-The-Last-Crusade-Antonito.jpg, the young Henry Jones's home, Colorado, Antonito," Front Street,  Indiana Jones Bed & Breakfast"
1291,https://www.movie-locations.com/movies/i/Indiana-Jones-And-The-Last-Crusade-Rickmansworth-School.jpg," 'Barnett College, New York', where Indy teaches", Hertfordshire, Rickmansworth, Rickmansworth Masonic School
1291,https://www.movie-locations.com/movies/i/Indiana-Jones-And-The-Last-Crusade-Wills-Grove.jpg, Prof Henry Jones's 'New York' home, London NW7, Mill Hill," Wills Grove,  Park Lodge"
1291,https://www.movie-locations.com/movies/i/Indiana-Jones-And-The-Last-Crusade-Campo-San-Barnaba.jpg, looking for 'X' in the Venice 'library', Venice, Campo San Barnaba, Church of San Barnaba
1291,https://www.movie-locations.com/movies/i/Indiana-Jones-And-The-Last-Crusade-Palazzo-Barbaro-2.jpg, Kazim gives Indy vital information about his father, Venice, Canal Grande, Palazzo Barbaro
1291,https://www.movie-locations.com/movies/i/Indiana-Jones-And-The-Last-Crusade-Guadix-Station.jpg, Dr Brody arrives in ‘Iskenderun’, Spain, Guadix Station,
1291,https://www.movie-locations.com/movies/i/Indiana-Jones-And-The-Last-Crusade-Stowe-School.jpg, the Nazi rally in ‘Berlin’, Buckinghamshire, Stowe School,
1291,https://www.movie-locations.com/movies/i/Indiana-Jones-And-The-Last-Crusade-Treasure-Island.jpg, the exterior of ‘Berlin Airport’, San Francisco, Treasure Island, Administration Building
1291,https://www.movie-locations.com/movies/i/Indiana-Jones-And-The-Last-Crusade-Lawrence Hall.jpg, ‘Berlin Airport’, London SW1, Westminster, The Royal Horticultural Hall
1291,https://www.movie-locations.com/movies/i/Indiana-Jones-And-The-Last-Crusade-Playa-De-Monsul.jpg, Jones Sr brings down the plane with a flock of seagulls, Spain, Almeria, Playa De Monsul
1291,https://www.movie-locations.com/movies/i/Indiana-Jones-And-The-Last-Crusade-School-Of-Arts-Almeria.jpg," Donovan trades his Rolls in the 'Iskenderun' palace courtyard""", Spain, Almeria," Plaza Pablo Cazard,  Escuela de Arte De Almeria (School of Arts & Crafts) "
1291,https://www.movie-locations.com/movies/i/Indiana-Jones-And-The-Last-Crusade-Siq.jpg, the 'Canyon of the Crescent Moon' leading to the Grail, Jordan, Wadi Musa, The Siq
59615,https://www.movie-locations.com/movies/i/Indiana-Jones-Crystal-Skull-University-Of-The-Pacific.jpg," ‘Marshall College, New Haven’", California, Stockton," University of the Pacific,  Conservatory of Music"
59615,https://www.movie-locations.com/movies/i/Indiana-Jones-Crystal-Skull-Yale-Campus.jpg, the chase through the demo, Connecticut, New Haven," Yale University,  Old Campus Courtyard"
59615,https://www.movie-locations.com/movies/i/Indiana-Jones-Crystal-Skull-Sterling-Memorial-Library.jpg, the chase into the library, New Haven Connecticut, Yale University, Sterling Memorial Library
59615,https://www.movie-locations.com/movies/i/Indiana-Jones-Crystal-Skull-Iguacu-Falls.jpg, the waterfall, Brazil-Argentina, Iguacu Falls,
780,https://www.movie-locations.com/movies/i/Independence-Day-US-Bank-Tower.jpg, New-Agers gather on the rooftop to welcome the visitors, Downtown Los Angeles, West 5th Street, US Bank Tower
780,https://www.movie-locations.com/movies/i/Independence-Day-West-74th-Street.jpg, the Dubrow home, Los Angeles, West 74th Street,
780,https://www.movie-locations.com/movies/i/Independence-Day-Millennium-Biltmore-Hotel_ext.jpg, the First Lady gets a warning to leave the city, downtown Los Angeles, 506 South Grand Avenue, Millennium Biltmore Hotel
60040,https://www.movie-locations.com/movies/i/Incredible-Hulk-Rocinha-Rio-De-Janeiro.jpg, Bruce Banner lies low in the Brazilian Favela, Brazil, Rio De Janeiro, Rocinha Favela
60040,https://www.movie-locations.com/movies/i/Incredible-Hulk-Floresta-Da-Tijuca.jpg, Bruce Banner turns up in the jungle of ‘Guatemala’, Brazil, Rio De Janeiro, Tijuca Forest
79132,https://www.movie-locations.com/movies/i/Inception-Da-Stuzzi.jpg," the ‘Café Debussy’, where Cobb reveals to Ariadne that they are within a dream", Paris, 7th arrondissement," 6 rue Cesar Franck,  Il Russo (formerly Da Stuzzi Patisserie)"
79132,https://www.movie-locations.com/movies/i/Inception-Farnborough-Airport.jpg, Saito’s helicopter touches down in 'Kyoto', Hampshire, Farnborough Airport,
79132,https://www.movie-locations.com/movies/i/Inception-Musee-Galliera.jpg, the entrance to the academy where Cobb meets Miles, Paris, Avenue Pierre 1er de Serbie, Palais Galliera
79132,https://www.movie-locations.com/movies/i/Inception-Flaxman-Gallery.jpg, Cobb meets architecture student Ariadne, London, Gower Street," University College of London,  Flaxman Gallery"
79132,https://www.movie-locations.com/movies/i/Inception-Passy-Metro-Station.jpg, the entrance to Cobb's Paris workshop, Paris, Square Alboni, Passy MÃ©tro Station
79132,https://www.movie-locations.com/movies/i/Inception-Mill-Street-Lofts.jpg, the interior of Cobb's 'Paris' workshop, Los Angeles, East 7th Street, Mill Street Lofts
79132,https://www.movie-locations.com/movies/i/Inception-Rue-Valentin-Hauy.jpg, Ariadne experiments with 'dream geometry', Paris, 7th arrondissement, rue Valentin Hauy
79132,https://www.movie-locations.com/movies/i/Inception-Pont-Bir-Hakeim-steps.jpg, Ariadne creates the footbridge, Paris, Avenue du President Kennedy,
79132,https://www.movie-locations.com/movies/i/Inception_Pont_Bir_Hakeim.jpg,  Ariadne is warned about basing her creations on real places, Paris, Pont de Bir-Hakeim,
79132,https://www.movie-locations.com/movies/i/Inception-Farmiloe-Building.jpg, Yusuf’s ‘Mombasa’ pharmacy, London EC1, Clerkenwell," 28-36 St John Street,  The Farmiloe Building"
79132,https://www.movie-locations.com/movies/i/../j/Jack-Ryan-Shadow-Recruit-Victoria-House.jpg, the suite of dying businessman Fischer, London WC1, Bloomsbury Square, Victoria House
79132,https://www.movie-locations.com/movies/i/Inception-Wilshire-Hope.jpg, the team discusses how to 'plant' an idea into Fischer's mind, Downtown Los Angeles, Wilshire Boulevard at Hope Street,
79132,https://www.movie-locations.com/movies/i/Inception-Creative-Arts-Agency.jpg, the hotel lobby and bar, Los Angeles, Century City," Avenue of the Stars,  Creative Artists Agency"
79132,https://www.movie-locations.com/movies/i/Inception-South-Grand-Avenue.jpg, Cobb’s home, Pasadena, South Grand Avenue,
79132,https://www.movie-locations.com/movies/i/Inception-Wilshire-&-Hope.jpg, picking up Fischer Jr in the stolen yellow cab, Downtown Los Angeles, Wilshire Boulevard at Hope Street,
79132,https://www.movie-locations.com/movies/i/Inception-Spring-&-Seventh.jpg, Cobb's unconscious mind conjures up a railway train in the street, Downtown Los Angeles, South Spring Street at 7th Street,
79132,https://www.movie-locations.com/movies/i/Inception-Ahmanson-Theatre.jpg, Cobb walks with his wife in the city they created, Downtown Los Angeles, North Hope Street," Music Center,  Ahmanson Theatre walkway"
79132,https://www.movie-locations.com/movies/i/Inception-John-Ferraro-Building.jpg, the city waterway with the submerged buildings, Downtown Los Angeles, North Hope Street, John Ferraro Building
79132,https://www.movie-locations.com/movies/i/Inception-Frank-Court.jpg, Cobb’s wife leaps from the window, downtown Los Angeles, Frank Court at  Fifth Street, the Chester Williams Building
79132,https://www.movie-locations.com/movies/i/Inception-Heims-Bridge.jpg, Yusuf drives the van off the bridge, Port of Los Angeles, Commodore Schuyler F Heims Draw Bridge,
116797,https://www.movie-locations.com/movies/i/Imitation-Game-Chesham-Church-Street.jpg, Joan Clarkeâs lodgings in âBletchleyâ, Buckinghamshire, Chesham, Church Street
116797,https://www.movie-locations.com/movies/i/Imitation-Game-Central-St-Martins.jpg, Alan Turing meets Menzies in the MI6 HQ, London WC1, Holborn," Southampton Row,  Lethaby Building"
69951,https://www.movie-locations.com/movies/i/Imaginarium-Of-Dr-Parnassus-Vancouver-Public-Library.jpg, Parnassus reduced to begging outside the shopping mall, Vancouver, Vancouver Public Library,
69951,https://www.movie-locations.com/movies/i/Imaginarium_Clerkenwell.jpg, the Imaginarium beats a hasty retreat, London EC3, Clerkenwell, Clerkenwell Close
69951,https://www.movie-locations.com/movies/i/Imaginarium-Of-Dr-Parnassus-Orpheum-Theatre.jpg, the disastrous childrenâs charity bash, Vancouver, Orpheum Theatre,
47610,https://www.movie-locations.com/movies/i/Illusionist-Vinohrady-Theatre.jpg, Eisenheim performs at the 'Vienna' theatre, Prague, Vinohrady Theatre,
47610,https://www.movie-locations.com/movies/i/Illusionist-Dlouha.jpg, Sophie is fascinated by the young Eisenheim, Czech Republic, ÄeskÃ½ Krumlov, DlouhÃ¡
47610,https://www.movie-locations.com/movies/i/Illusionist-Latran-arch.jpg, Young Eisenheim follows the Duchess's carriage, Czech Republic, ÄeskÃ½ Krumlov, LatrÃ¡n
47610,https://www.movie-locations.com/movies/i/Illusionist-Latran-castle.jpg, Eisenheim watches as the Duchess's carriage returns to her chateau, Czech Republic, ÄeskÃ½ Krumlov, LatrÃ¡n
47610,https://www.movie-locations.com/movies/i/Illusionist-Cesky-Krumlov-Castle.jpg, the Duchess's chateau, Czech Republic, ÄeskÃ½ Krumlov, ÄeskÃ½ Krumlov Castle
47610,https://www.movie-locations.com/movies/i/Illusionist-Vinohrady-Theatre-stagedoor.jpg, the Duchess sends a message to Eisenheim at the 'Vienna' theatre, Prague, Vinohrady Theatre,
47610,https://www.movie-locations.com/movies/i/Illusionist-Cafe-Imperial.jpg, Eisenheim’s manager Josef reads the excellent reviews, Prague, Na PoÅÃ­ÄÃ­, Cafe Imperial
47610,https://www.movie-locations.com/movies/i/Illusionist-Palace-gates.jpg,the entrance to the Prince's 'Hofburg Palace', Prague, HradÄanskÃ© nÃ¡mÄstÃ­, Prague Castle
47610,https://www.movie-locations.com/movies/i/Illusionist-police-HQ.jpg, Uhl's police headquarters, Prague, PolitickÃ½ch vÄzÅÅ¯, Economic Institute
89804,https://www.movie-locations.com/movies/i/Ides_Of_March_Cliff_Bell.jpg, Stephen Meyers and his boss meet up with the journalist at ‘Ninth and Vine’, Detroit, Park Avenue, Cliff Bellâs
89804,https://www.movie-locations.com/movies/i/Ides-Of-March-Griswold-Street.jpg, Governor Morris’s campaign HQ in ‘Cincinnati’, Detroit, Griswold Street at Grand River Avenue,
89804,https://www.movie-locations.com/movies/i/Ides-Of-March-Marilyns.jpg, Meyers has a clandestine meeting with Morris in the darkened kitchen, Detroit, Monroe Street, Marilyn’s
8644,https://www.movie-locations.com/movies/i/I-Robot-Ovaltine-Cafe.jpg, Spooner voices suspicions to his superior, Vancouver, 251 East Hastings Street, Ovaltine Cafe
8644,https://www.movie-locations.com/movies/i/I-Robot-Shannon-Mews.jpg, Lanning’s mansion is demolished as Spooner snoops around, South Vancouver, Granville Street, Shannon Mews
6614,https://www.movie-locations.com/movies/i/I-Love-You-To-Death-Java-Jive.jpg," Bob's Java Jive, South Tacoma Way, Tacoma, Washington Stat", Washington State, Tacoma," South Tacoma Way,  Bob's Java Jive"
67087,https://www.movie-locations.com/movies/i/I-Love-You-Man-James-Beach.jpg, Pete and Sydney sample the “best fish tacos in the world”, Venice Beach, North Venice Boulevard, James Beach Restaurant
67087,https://www.movie-locations.com/movies/i/I-Love-You-Man-Franklin-Avenue.jpg, Pete Klaven's stylish home, Los Angeles, Los Feliz, Franklin Avenue
67087,https://www.movie-locations.com/movies/i/I-Love-You-Man-Hop-Louie.jpg, the engagement party, Los Angeles, Chinatown," Mei Ling Way,  Hop Louie"
67087,https://www.movie-locations.com/movies/i/I-Love-You-Man-Avalon-Hollywood.jpg, Zooey gets frozen out at the Rush concert, Los Angeles, Hollywood," Vine Street,  Avalon Hollywood"
67087,https://www.movie-locations.com/movies/i/I-Love-You-Man-Venice-Ale-House.jpg, Sydney tangles with the Hulk, Venice Beach, Rose Avenue, Venice Ale House
2185,https://www.movie-locations.com/movies/i/I-Confess-Chateau-Frontenac.jpg," Chateau Frontenac, Quebe", Quebec, Chateau Frontenac,
2185,https://www.movie-locations.com/movies/i/I-Confess-Saint-Zephirin.jpg, Father Logan's church, QuÃ©bec, Limoilou," avenue FranÃ§ois 1,  Ãglise Saint-ZÃ©phirin-de-Stadacona"
5014,https://www.movie-locations.com/movies/i/I-Am-Sam-Wonder-Palms.jpg, Sam’s ‘downtown’ apartment, Santa Monica, California Avenue, Wonder Palms
85056,https://www.movie-locations.com/movies/i/I-Am-Number-Four-Buttermilk-Falls.jpg, John Smith tries out his special powers, Pennsylvania, Homewood, Buttermilk Falls
26116,https://www.movie-locations.com/movies/h/Hush-Hush-Sweet-Charlotte-Houmas-House.jpg, The Southern mansion, Louisiana, Burnside, Houmas House
135133,https://www.movie-locations.com/movies/h/../b/Brazil-Palacio-Abraxas-gate.jpg, the team is nearly engulfed by oil in the Capitol, France, Noisy-le-Grand, Palacio d'Abraxas
135133,https://www.movie-locations.com/movies/h/../b/Brazil-Palacio-Abraxas.jpg, the team makes its way through the Capitol, France, Noisy-le-Grand, Palacio d'Abraxas
135133,https://www.movie-locations.com/movies/h/Hunger-Games-Mockingjay-Part-2-Ivry-Sur-Seine.jpg, the team is hidden in the Capitol by Tigris, France, Val de Marne, Ivry Sur Seine
135133,https://www.movie-locations.com/movies/h/../e/Equilibrium-Altes-Stadthaus.jpg," the exterior of the Altes Stadthaus, KlosterstraÃe, Berli", Berlin, KlosterstraÃe, the exterior of the Altes Stadthaus
116823,https://www.movie-locations.com/movies/h/Hunger-Games-Mockingjay-Part-1-Chateau-De-Voisins.jpg, the interior of Snow's mansion, France, Louveciennes, Chateau de Voisins
116823,https://www.movie-locations.com/movies/h/Hunger-Games-Mockingjay-Park-1-Swan-House.jpg, the exterior of Snow's mansion, Atlanta, Swan House,
116823,https://www.movie-locations.com/movies/h/Hunger-Games-Mockingjay-Park-1-Sweetwater-Creek-State-Park.jpg, Katniss and Liam go hunting, Atlanta, Lithia Springs, Sweetwater Creek State Park
116823,https://www.movie-locations.com/movies/h/Hunger-Games-Mockingjay-Park-1-Bellwood-Quarry.jpg, Katniss sings The Hanging Tree, Atlanta, Chappell Road Northwest, Bellwood Quarry
116823,https://www.movie-locations.com/movies/h/Hunger-Games-Catching-Fire-Marriott-Marquis.jpg, the victors’ luxurious quarters, Georgia, Atlanta," Peachtree Center Avenue,  Marriott Marquis Hotel"
106487,https://www.movie-locations.com/movies/h/Hunger-Games-Catching-Fire-Marriott-Marquis.jpg, the victors’ luxurious quarters, Georgia, Atlanta," Peachtree Center Avenue,  Marriott Marquis Hotel"
106487,https://www.movie-locations.com/movies/h/Hunger-Games-Catching-Fire-Swan-House.jpg, the lavish party at Swan’s estate, Georgia, Atlanta, Swan House
6534,https://www.movie-locations.com/movies/h/Hulk-Montgomery-Vallejo.jpg, Hulk is cornered by the military in San Francisco, San Francisco, Vallejo Street,
6534,https://www.movie-locations.com/movies/h/Hulk-Arches-Moab.jpg, Hulk bounds through the desert, Utah, Arches National Park, Double Arch
90866,https://www.movie-locations.com/movies/h/Hugo-Theatre-Louis-Jouvet.jpg, The theatre of Georges Méliès, Paris, Rue Boudreau, ThÃ©Ã¢tre de lâAthÃ©nÃ©e-Louis-Jouvet
90866,https://www.movie-locations.com/movies/h/Hugo-Bibliotheque-Sainte-Genevieve.jpg, The 'Film Academy Library', Paris, 10 place du Panthéon, Bibliothèque Saint-Geneviève
471,https://www.movie-locations.com/movies/h/Hudsucker-Proxy-Merchandise-Mart.jpg, the Hudsucker Building, Chicago, Merchandise Mart,
3260,https://www.movie-locations.com/movies/h/Howards-End-Victoria-Square.jpg, home of the Schlegel sisters, London, Victoria, Victoria Square
3260,https://www.movie-locations.com/movies/h/Howards-End-Buckingham-Gate.jpg, the London home of Henry Wilcox, London, Victoria, 51 Buckingham Gate
3260,https://www.movie-locations.com/movies/h/../w/Wilde-South-Audley-Street.jpg, Wilcox proposes to Margaret Schlegel, London, Mayfair, South Audley Street
3260,https://www.movie-locations.com/movies/h/Howards-End-Simpsons-In-The-Strand.jpg, Henry takes Margaret to lunch, London, Strand, Simpson’s-in-the-Strand
6290,https://www.movie-locations.com/movies/h/House-Of-1000-Corpses-Four-Aces-Diner-s.jpg, ‘Captain Spaulding’s Museum of Monsters and Madmen’, California, Palmdale, Four Aces Diner
2148,https://www.movie-locations.com/movies/h/House-Monrovia.jpg, the possessed house, Monrovia, Melrose Avenue,
51255,https://www.movie-locations.com/movies/h/Hot-Fuzz-Wells-Square.jpg, the town of ‘Sandford’, Somerset, Wells, Market Square
51255,https://www.movie-locations.com/movies/h/Hot-Fuzz-Swan-Hotel.jpg, Nicholas Angel’s hotel, Somerset, Wells," Sadler Street,  The Swan"
51255,https://www.movie-locations.com/movies/h/Hot-Fuzz-Crown-At-Wells.jpg, the ‘Sandford’ pub, Somerset, The Crown at Wells,
51255,https://www.movie-locations.com/movies/h/Hot-Fuzz-City-News.jpg, the ‘Sandford’ newsagent, Somerset, Wells," High Street,  City News"
51255,https://www.movie-locations.com/movies/h/Hot-Fuzz-St-Cuthberts-Church.jpg, journalist Tim gets splatted, Somerset, Wells, St Cuthbert’s
51255,https://www.movie-locations.com/movies/h/Hot-Fuzz-Bishops-Palace.jpg, the NWA meeting, Somerset, Wells, Bishop’s Palace
51255,https://www.movie-locations.com/movies/h/Hot-Fuzz-Somerfield-Supermarket.jpg, the supermarket exterior, Somerset, Wells," High Street,  Somerfield"
51255,https://www.movie-locations.com/movies/h/../i/Into-The-Woods-Waverley-Abbey.jpg, the final chase, Surrey, Farnham, Waverley Abbey
160545,https://www.movie-locations.com/movies/h/Horror-Hospital-Knebworth.jpg, Nasty goings-on at 'Brittlehurst Manor', Hertfordshire, Stevenage, Knebworth House
841,https://www.movie-locations.com/movies/y/Yeux-Sans-Visage-Barrage-De-Noisiel.jpg, Louise disposes of a body in the 'Seine', France, Noisiel," River Marne,  Barrage de Noisiel"
2953,https://www.movie-locations.com/movies/h/Home-Alone-2-Rookery.jpg, ‘Duncan’s Toy Chest’, Chicago, South LaSalle Street, the Rookery Building
586,https://www.movie-locations.com/movies/h/Home-Alone-Winnetka.jpg, Kevin’s house, Illinois, Winnetka, 671 Lincoln Avenue
586,https://www.movie-locations.com/movies/h/Home-Alone-Wilmette-Church.jpg, the church exterior, Illinois, Wilmette," 1024 West Lake Avenue,  Trinity United Methodist Church"
203519,https://www.movie-locations.com/movies/f/Hobbs-And-Shaw-Leadenhall-Building.jpg, the CIA's 'Black Site', London EC3, Leadenhall Street, Leadenhall Building
203519,https://www.movie-locations.com/movies/f/Hobbs-And-Shaw-Petticoat-Lane.jpg, Hattie flees her flat, London E1, Wentworth Road, Middlesex Street Estate
203519,https://www.movie-locations.com/movies/f/Hobbs-And-Shaw-Leadenhall-Building-entrance.jpg, the street fight at the foot of the tower, London EC3, Leadenhall Street,
203519,https://www.movie-locations.com/movies/f/Hobbs-And-Shaw-McLaren-Technology-Centre.jpg, Brixton receives his orders at ETEON's hub, Surrey, Woking, McLaren Technology Centre
203519,https://www.movie-locations.com/movies/f/Hobbs-And-Shaw-Carpenters-Arms-ext.jpg, the pub with Shaw's armoury in its basement, London E1, Cheshire Street, Carpenters Arms
203519,https://www.movie-locations.com/movies/f/Hobbs-And-Shaw-Pennington-Street-Warehouse.jpg, Shaw's garage / armoury beneath the pub, London  E1, Pennington Street, Pennington Street Warehouse
203519,https://www.movie-locations.com/movies/f/Hobbs-And-Shaw-West-Wycombe.jpg, Madam M's 'Russian' mansion, Buckinghamshire, West Wycombe Park, West Wycombe House
203519,https://www.movie-locations.com/movies/f/../j/Jurassic-Park-NaPali-Coast.jpg, Hobbs returns to 'Samoa', Hawaii, Kauai, Na Pali Coast
203519,https://www.movie-locations.com/movies/f/Hobbs-And-Shaw-Koloa-Sugar-Mill.jpg, Hobbs returns to 'Samoa', Hawaii, Kauai," Koloa,  Old Sugar Mill"
203519,https://www.movie-locations.com/movies/f/Hobbs-And-Shaw-Carpenters-Arms-int.jpg, a message for 'Hugh Janus' in the pub, London E1, Cheshire Street, Carpenters Arms
175661,https://www.movie-locations.com/movies/h/Hitmans-Bodyguard-Bulgarian-National-Bank.jpg, the 'International Court in the Hague', Sofia, Bulgarian National Bank,
175661,https://www.movie-locations.com/movies/h/Hitmans-Bodyguard-Broadgate.jpg, Mr Seifert is escorted from his office, London EC2, Primrose Street, Broadgate Tower
175661,https://www.movie-locations.com/movies/h/Hitmans-Bodyguard-Blythe-House.jpg, the safe-house in 'Coventry', London, West Kensington, Blythe House
175661,https://www.movie-locations.com/movies/h/Hitmans-Bodyguard-Weteringschans.jpg, the 'Interpol Remand Center' in Amsterdam, Amsterdam, Weteringschans,
175661,https://www.movie-locations.com/movies/h/Hitmans-Bodyguard-Rijksmuseum.jpg, Kincaid leaves flowers beneath the clock, Amsterdam, The Rijksmuseum,
175661,https://www.movie-locations.com/movies/h/Hitmans-Bodyguard-Jan-Liujkenstraat.jpg, Bryce misses the carnage at the outdoor bar, Amsterdam, Jan Liujkenstraat,
175661,https://www.movie-locations.com/movies/h/Hitmans-Bodyguard-Clerkenwell-House-Of-Detention.jpg, Bryce is tortured in the 'Amsterdam' dungeon, London EC1, Sans Walk, Clerkenwell House of Detention
175661,https://www.movie-locations.com/movies/h/Hitmans-Bodyguard-Business-Park-Sofia-Metro-Station.jpg, Bryce escapes into the 'Hague' metro system, Sofia, Business Park Sofia metro station,
175661,https://www.movie-locations.com/movies/h/Hitmans-Bodyguard-Freemasons-Hall.jpg," the corridors of the 'International Court of Justice, The Hague'", London WC2, Covent Garden, Freemasons Hall
31685,https://www.movie-locations.com/movies/h/Hitch-Rice-To-Riches.jpg, Sara mulls over the possibilities, New York, Spring Street, Rice To Riches
31685,https://www.movie-locations.com/movies/h/../g/Ghostbusters-Firehouse.jpg, Hitch helps out the lovestruck fireman, New York, North Moore Street, 8 Hook and Ladder Firehouse
31685,https://www.movie-locations.com/movies/h/Hitch-Balthazar.jpg, Hitch armlocks the obnoxious Vance, New York, Spring Street, Balthazar Restaurant
31685,https://www.movie-locations.com/movies/h/Hitch-North-Moore-Street.jpg, Hitch’s stylish apartment, New York, North Moore Street,
31685,https://www.movie-locations.com/movies/h/Hitch-9th-Avenue.jpg, Hitch comes on to Sara at the Amp Lounge, New York, 9th Avenue at 13th Street,
31685,https://www.movie-locations.com/movies/h/Hitch-Seagram-Building.jpg, Albert carries a torch for Allegra, New York, Park Avenue, Seagram Building
31685,https://www.movie-locations.com/movies/h/Hitch-Greene-Street.jpg, the zonked-out Hitch crashes at Sara’s place, New York, Greene Street,
31685,https://www.movie-locations.com/movies/h/Hitch-Cunard-Building.jpg, Sara gets details of the mysterious ‘date doctor’ from Vance, New York, Financial District, Broadway
31685,https://www.movie-locations.com/movies/h/Hitch-106th-Street.jpg, Albert even manages a successful kiss as he drops off Allegra, New York, Upper West Side, 106th Street
31685,https://www.movie-locations.com/movies/h/../n/North-By-Northwest-Old-Westbury-Gardens.jpg, Albert and Allegra finally get hitched, Long Island, Old Westbury Gardens,
1211,https://www.movie-locations.com/movies/w/Wings-Of-Desire-Siegessaule-statue.jpg, the angels look out over the city, Berlin, Tiergarten, Siegessaule
1211,https://www.movie-locations.com/movies/w/Wings-Of-Desire-Kaiser-Wilhelm-Church.jpg, Damiel is perched atop the broken spire, Berlin, Breitscheidplatz, Kaiser Wilhelm GedÃ¤chtniskirche
1211,https://www.movie-locations.com/movies/w/Wings-Of-Desire-ICC-Berlin.jpg, angels fly over the city,-,-, ICC Berlin
1211,https://www.movie-locations.com/movies/w/Wings-Of-Desire-Staatsbibliotek.jpg, the angels haunt the library, Berlin, Staatsbibliotek,
1211,https://www.movie-locations.com/movies/w/Wings-Of-Desire-Langenscheidtbrucke.jpg, Damiel comforts the dying man, Berlin, SchÃ¶neberg, Langenscheidtbrucke
1211,https://www.movie-locations.com/movies/w/Wings-Of-Desire-Czeminskistrasse.jpg, Damiel comforts the dying man, Berlin, SchÃ¶neberg, Czeminskistrasse
1211,https://www.movie-locations.com/movies/w/Wings-Of-Desire-Siegessaule.jpg, the angels look out over the city, Berlin, Tiergarten, Siegessaule
1211,https://www.movie-locations.com/movies/w/Wings-Of-Desire-Schoneberger-Strasse.jpg, the fraught young woman selling herself on the street, Berlin, SchÃ¶neberger StraÃe,
1211,https://www.movie-locations.com/movies/w/Wings-Of-Desire-Anhalter-Bahnhof.jpg," Peter Falk visits ""the station where the station stopped""", Berlin, Asketischer Platz, Anhalter Bahnhof
1211,https://www.movie-locations.com/movies/w/Wings-Of-Desire-Goebenstrasse.jpg," newly human, Damiel trades in his breastplate at the second-hand store", Berlin, GoebenstraÃe,
1211,https://www.movie-locations.com/movies/w/Wings-Of-Desire-Esplanade.jpg, fragments of the old Hotel Esplanade, Berlin, Potsdamer Platz, Sony Centre
1275,https://www.movie-locations.com/movies/h/Highlander-Greene-Street.jpg," Macleod’s New York home, ‘Russell Nash Antiques’", Manhattan, Greene Street in SoHo,
1275,https://www.movie-locations.com/movies/h/Highlander-Eilean-Donan-Castle.jpg, the Scottish castle, Scotland, Eilean Donan Castle,
1275,https://www.movie-locations.com/movies/h/Highlander-Peter-McManus.jpg, Macleod follows Brenda to the bar, Manhattan, Chelsea," 152 Seventh Avenue,  Peter McManus Cafe"
1275,https://www.movie-locations.com/movies/h/Highlander-Bow-Bridge.jpg, Macleod meets up with Kastagir, New York, Central Park, Bow Bridge
2921,https://www.movie-locations.com/movies/h/High-Plains-Drifter-Mono-Lake.jpg, the site of the town of 'Lago', California, Mono Lake,
2921,https://www.movie-locations.com/movies/h/High-Plains-Drifter-Mono-Lake-tufa-towers.jpg, the famous tufa towers â not seen in the film, California, Mono Lake,
