movieId,lucationUrl,locationRef,city/country,area/street,location
1103,https://www.movie-locations.com/movies/r/Rebel-Without-A-Cause-house-rear.jpg, the rear of the Stark house, Los Angeles, Ladera Heights, alley on South Citrus Avenue
1103,https://www.movie-locations.com/movies/r/Rebel-Without-A-Cause-alleyway.jpg, Jim says 'hi' to Judy outside her house, Los Angeles, Ladera Heights, alley on South Citrus Avenue
1103,https://www.movie-locations.com/movies/r/Rebel-Without-A-Cause-Judys-house.jpg, Judy's house, Los Angeles, Ladera Heights, South Citrus Avenue
1103,https://www.movie-locations.com/movies/r/Rebel-Without-A-Cause-house-front.jpg, the front of the Stark house, Los Angeles, Ladera Heights, alley on West 62nd Street
1103,https://www.movie-locations.com/movies/r/Rebel-Without-A-Cause-street.jpg, the kids head off to 'Dawson High', Los Angeles, Ladera Heights, South Citrus Avenue
1103,https://www.movie-locations.com/movies/r/Rebel-Without-A-Cause-Santa-Monica-High-School.jpg, Jim Stark's high school, Los Angeles, Santa Monica," Pico Boulevard,  Santa Monica High School"
1103,https://www.movie-locations.com/movies/r/../p/Pretty-In-Pink-John-Marshall-High-School-2.jpg, interiors of ‘Dawson High’, Silverlake, Tracy Street, John Marshall High School
1103,https://www.movie-locations.com/movies/r/Rebel-Without-A-Cause-observatory-1.jpg, Jim Stark watches as his car tyre is slashed, Los Angeles, Griffith Park, Griffith Observatory
1103,https://www.movie-locations.com/movies/r/Rebel-Without-A-Cause-observatory-fight.jpg, the knife fight on the school trip, Los Angeles, Griffith Park," Griffith Observatory,  Terrace"
1103,https://www.movie-locations.com/movies/r/Rebel-Without-A-Cause-Griffith-Observatory-2.jpg, The school trip and the climactic shoot-out, Los Angeles, Griffith Park, Griffith Observatory
90249,https://www.movie-locations.com/movies/r/Real-Steel-GM-Center.jpg," ‘New York’s Bing Arena’, where Atom faces the mighty Zeus", Detroit, Detroit Riverwalk, GM Renaissance Center
90249,https://www.movie-locations.com/movies/r/Real-Steel-Belle-Isle-Zoo.jpg,   Atom gets his first fight against Metro at ‘Shaefer Zoo’, Detroit, Belle Isle, Belle Isle Nature Zoo
90249,https://www.movie-locations.com/movies/r/Real-Steel-Parkway-Motel.jpg,  Max teaches Atom to dance, Davisburg, Dixie Highway, Parkway Motel
90249,https://www.movie-locations.com/movies/r/Real-Steel-Jefferson-Avenue.jpg, Max is handed over to his foster parents at the ‘Tarryton Towers’, Detroit, Jefferson Avenue, GM Renaissance Center
140956,https://www.movie-locations.com/movies/r/Ready-Player-One-City-Point.jpg, the exterior of IOI, London EC2, Ropemaker Street, CityPoint
140956,https://www.movie-locations.com/movies/r/Ready-Player-One-Livery-Street-1.jpg," the streets of 'Columbus, Ohio â 2045'", Birmingham, Livery Street,
140956,https://www.movie-locations.com/movies/r/Ready-Player-One-Typhoo-Tea-Factory-Birmingham.jpg," Samantha's roof garden, overlooking the city", Birmingham, Bordesley Road, Typhoo Tea Factory
140956,https://www.movie-locations.com/movies/r/Ready-Player-One-Mary-Ann-Street.jpg, the IOI drones search for Wade, Birmingham, Mary Ann Street at Livery Street,
140956,https://www.movie-locations.com/movies/r/Ready-Player-One-Lionel-Street-market.jpg, the drones spot the tattooed guy buying groceries, Birmingham, Lionel Street, Lionel House Car Park
140956,https://www.movie-locations.com/movies/r/Ready-Player-One-Fountayne-Road.jpg, Wade meets up with the rest of the High-Five, London N15, Seven Sisters, Fountayne Road
140956,https://www.movie-locations.com/movies/r/Ready-Player-One-Floodgate-Street-arch.jpg, Aech drives the postal van into the yard, Birmingham, Floodgate Street,
140956,https://www.movie-locations.com/movies/r/Ready-Player-One-Floodgate-Street-yard.jpg, the High-Five lie low beneath the railway arch, Birmingham, Floodgate Street,
140956,https://www.movie-locations.com/movies/r/Ready-Player-One-Moorfields.jpg, F'nale sees the virtual fighters outside 'Starbucks', London EC2, Moorfields,
140956,https://www.movie-locations.com/movies/r/Ready-Player-One-Ropemaker-Street.jpg," more fighting kids, outside 'Okagami'", London EC2, Ropemaker Street,
140956,https://www.movie-locations.com/movies/r/Ready-Player-One-Lionel-Street-2.jpg, the van picks up Samantha after her escape, Birmingham, Lionel Street,
140956,https://www.movie-locations.com/movies/r/Ready-Player-One-Livery-Street.jpg, the van chase through 'Columbus', Birmingham, Livery Street,
8958,https://www.movie-locations.com/movies/r/Ray-Southridge-Avenue.jpg, Ray Charles's mansion, Los Angeles, View Park, Southridge Avenue
8958,https://www.movie-locations.com/movies/r/Ray-Hepburn-Avenue.jpg, Ray Charles's former home, Los Angeles, Leimert Park, Hepburn Avenue
86559,https://www.movie-locations.com/movies/d/Death-Line-Grafton-Mansions.jpg, the apartment of Alex and Patricia, London WC1, Bloomsbury," Duke's Road,  Grafton Mansions"
7636,https://www.movie-locations.com/movies/r/Raising-Cain-Legion-Of-Honor.jpg, Jenny's guilt-ridden dream, San Francisco, Lincoln Park, Legion of Honor
1394,https://www.movie-locations.com/movies/r/Raising-Arizona-Phoenician.jpg, home of the Arizona family and the Quints, Arizona, Scottsdale," Phoenician Resort,  Jokake Inn"
1961,https://www.movie-locations.com/movies/r/Rain-Man-Sunset-Plaza-Drive.jpg, Charlie Babbitt's apartment, Los Angeles, West Hollywood, Sunset Plaza Drive
1961,https://www.movie-locations.com/movies/r/../s/Strange-Days-Westin-Bonaventure.jpg, the offer from Dr Bruner, downtown Los Angeles, South Figueroa, Westin Bonaventure Hotel
1961,https://www.movie-locations.com/movies/r/Rain-Man-Wattles-Mansion.jpg, the custody battle, Los Angeles, Hollywood, Wattles Mansion
278046,https://www.movie-locations.com/movies/r/Railway-Children-Oakworth-Station.jpg," Oakworth Station, West Yorkshir", West Yorkshire, Oakworth Station,
278046,https://www.movie-locations.com/movies/r/Railway-Children-Hampstead-house.jpg, the London home, NW3, Hampstead, Gainsborough Gardens
278046,https://www.movie-locations.com/movies/r/Railway-Children-Gainsborough-Gardens-street.jpg, Mrs Waterbury returns to the London house, NW3, Hampstead, Gainsborough Gardens
278046,https://www.movie-locations.com/movies/r/Railway-Children-Haworth-shop.jpg, the village store, West Yorkshire, Haworth, Church Lane
1198,https://www.movie-locations.com/movies/r/Raiders-Of-The-Lost-Ark-City-Hall-steps.jpg, Indy and Marion left at  the government building, San Francisco, Polk Street, San Francisco City Hall
1228,https://www.movie-locations.com/movies/r/Raging-Bull-swimming-pool.jpg, LaMotta meets Vickie at the open-air pool, New York, Greenwich Village," Clarkson Street,  Tony Dapolito Recreation Center"
1228,https://www.movie-locations.com/movies/r/Raging-Bull-Cabrillo-Boulevard.jpg, LaMotta's 'Florida' home, Los Angeles, Venice Beach, Cabrillo Boulevard
1228,https://www.movie-locations.com/movies/r/Raging-Bull-Webster-Hall.jpg," The 'Chester Palace' dance, where LaMotta first sees wife-to-be, Vickie", New York, Greenwich Village," East 11th Street,  Webster Hall"
3993,https://www.movie-locations.com/movies/q/../m/Madness-Of-King-George-Painted-Hall.jpg, the ‘Palace of Versailles’, London, Greenwich, the Painted Hall of the Royal Naval College
63113,https://www.movie-locations.com/movies/q/Quantum-Of-Solace-Siena.jpg," the palio, horse race", Italy, Siena,
47099,https://www.movie-locations.com/movies/p/Pursuit-Of-Happyness-Ross-Alley-Dayschool.jpg, Chris Gardner leaves his son at the day school, San Francisco, Chinatown, Ross Alley
47099,https://www.movie-locations.com/movies/p/Pursuit-Of-Happyness-York-Street.jpg, the Gardner family home, San Francisco, Mission District, York Street
47099,https://www.movie-locations.com/movies/p/Pursuit-Of-Happyness-Stock-Exchange.jpg, Gardner asks what the Ferrari driver does for a living, San Francisco, Financial District," Pine Street,  Pacific Exchange"
47099,https://www.movie-locations.com/movies/p/Pursuit-Of-Happyness-555-California.jpg, Chris gets a position at 'Dean Witter Reynolds', San Francisco, California Street,
47099,https://www.movie-locations.com/movies/p/Pursuit-Of-Happyness-Hermann-Street.jpg, Gardner leaps out of the cab without paying, San Francisco, Duboce Park, Hermann Street
47099,https://www.movie-locations.com/movies/p/Pursuit-Of-Happyness-Duboce-Park.jpg, Gardner sprints away from the irate cab driver, San Francisco, Duboce Park,
47099,https://www.movie-locations.com/movies/p/Pursuit-Of-Happyness-Glen-Park-Station.jpg, Chris and his son in the BART station, San Francisco, Glen Park Station,
47099,https://www.movie-locations.com/movies/p/Pursuit-Of-Happyness-Glide.jpg, Chris and his son find a room in the homeless shelter, San Francisco, Tenderloin," Ellis Street,  Glide"
47099,https://www.movie-locations.com/movies/p/Pursuit-Of-Happyness-North-Beach-Pizza.jpg, Chris takes his son to the diner, San Francisco, North Beach," Grant Avenue,  North Beach Pizza"
47099,https://www.movie-locations.com/movies/p/Pursuit-Of-Happyness-Broadway-Taylor.jpg, the happy ending, San Francisco, Broadway at Taylor Street,
5673,https://www.movie-locations.com/movies/p/Punch-Drunk-Love-Eckhart-Auto-Body.jpg, the toilet plunger business where Barry Egan works, Chatsworth, Canoga Avenue, Eckhart Autobody
296,https://www.movie-locations.com/movies/p/Pulp-Fiction-Jack-Rabbit-Slims.jpg, 'Jack Rabbit Slim's', California, Glendale, Flower Street
296,https://www.movie-locations.com/movies/p/Pulp-Fiction-Hawthorne-Grill.jpg, Honey-Bunny and Pumpkin in the diner, Los Angeles, Hawthorne," 13763 Hawthorne Boulevard,  Hawthorne Grill (now demolished)"
296,https://www.movie-locations.com/movies/p/Pulp-Fiction-pawnshop.jpg, “I ain't through with you by a damn sight. I'ma get medieval on your ass.”, Los Angeles, Canoga Park," Roscoe Boulevard,  Crown Pawn Shop"
69640,https://www.movie-locations.com/movies/p/Public-Enemies-Biograph.jpg, Dillinger is finally gunned down, Chicago, North Lincoln Avenue, The Biograph Theatre
69640,https://www.movie-locations.com/movies/p/../b/Batman-V-Superman-Aragon-Ballroom.jpg, John Dillinger meets Billie Frechette at the nightclub, Chicago, Northside," Lawrence Avenue,  The Aragon"
94864,https://www.movie-locations.com/movies/p/Prometheus-Isle-Of-Skye.jpg, the archaeological discovery, Scotland, Isle of Skye, Old Man of Storr
94864,https://www.movie-locations.com/movies/p/Prometheus-Dettifoss-Waterfall.jpg, the Engineer on his home planet, Iceland, Dettifoss Waterfall,
94864,https://www.movie-locations.com/movies/p/../l/Lawrence-Of-Arabia-Wadi-Rum.jpg, the surface of the alien planet, Jordan, the cliffs of Wadi Rum,
6581,https://www.movie-locations.com/movies/p/Private-Life-Of-Sherlock-Holmes-Castle-Urquhart.jpg, the mysterious Scottish castle, Scotland, Loch Ness, Castle Urquhart
6581,https://www.movie-locations.com/movies/p/Private-Life-Of-Sherlock-Holmes-Somerset-House-club.jpg, Holmes visits his brother at the ‘Diogenes Club’, London, The Strand, Somerset House
6312,https://www.movie-locations.com/movies/p/Private-Function-Albert-Road-Barnoldswick.jpg, Gilbert's premises on The Parade, Lancashire, Barnoldswick, Albert Road
6312,https://www.movie-locations.com/movies/p/Private-Function-Majestic-Buildings-Barnoldswick.jpg, the 'Majestic Cinema' on The Parade, Lancashire, Barnoldswick, Albert Road
6312,https://www.movie-locations.com/movies/p/Private-Function-Winter-Garden-Ilkley.jpg, the 'Grand Hotel', West Yorkshire, Ilkley," Station Road,  King's Hall and Winter Garden"
4700,https://www.movie-locations.com/movies/p/Princess-Diaries-Brazil-Avenue.jpg, the home of Mia Thermopolis and her mother, San Francisco, Excelsior District, Brazil Avenue
4700,https://www.movie-locations.com/movies/p/Princess-Diaries-Lyon-Street.jpg, Mia attends 'Grove High School', San Francisco, Marina District, Lyon Street
4700,https://www.movie-locations.com/movies/p/Princess-Diaries-Doheny-Mansion.jpg, The ‘Consulate of Genovia’, Los Angeles, Chester Place, Doheny Mansion
4700,https://www.movie-locations.com/movies/p/Princess-Diaries-Phoenix-Terrace.jpg, The home of Lilly and Michael Moscowitz, San Francisco, Phoenix Terrace,
4700,https://www.movie-locations.com/movies/p/Princess-Diaries-Longford-Castle.jpg, The ‘Castle of Genovia’, Wiltshire, Bodenham, Longford Castle
8754,https://www.movie-locations.com/movies/p/Prime-Of-Miss-Jean-Brodie-Admiral-Terrace-house.jpg, Miss Brodie’s home, Edinburgh, Admiral Terrace,
8754,https://www.movie-locations.com/movies/p/Prime-Of-Miss-Jean-Brodie-The-Vennel.jpg, Miss Brodie leads her charges through the streets of Edinburgh, Edinburgh, The Vennel,
8754,https://www.movie-locations.com/movies/p/Prime-Of-Miss-Jean-Brodie-Greyfriars-Churchyard.jpg, Miss Brodie and the girls stroll through the churchyard, Edinburgh, Greyfriars Churchyard,
8754,https://www.movie-locations.com/movies/p/Prime-Of-Miss-Jean-Brodie-Greyfriars-Churchyard-view.jpg, Teddy Lloyd's studio from the churchyard, Edinburgh, Greyfriars Churchyard,
8754,https://www.movie-locations.com/movies/p/Prime-Of-Miss-Jean-Brodie-Greyfriars-Churchyard-steps.jpg, Teddy Lloyd rushes out to meet Jean, Edinburgh, Greyfriars Churchyard,
8754,https://www.movie-locations.com/movies/p/Prime-Of-Miss-Jean-Brodie-Candlemaker-Row.jpg, Miss Brodie’s home, Edinburgh, Admiral Terrace,
8754,https://www.movie-locations.com/movies/p/Prime-Of-Miss-Jean-Brodie-Admiral-Terrace.jpg, Miss Brodie’s home, Edinburgh, Admiral Terrace,
8754,https://www.movie-locations.com/movies/p/Prime-Of-Miss-Jean-Brodie-Henderson-Row.jpg, the entrance to ‘Marcia Blaine School’, Edinburgh, Henderson Row, Edinburgh Academy
8754,https://www.movie-locations.com/movies/p/Prime-Of-Miss-Jean-Brodie-Barnbougle.jpg, Miss Brodie gets away to ‘Cramond’ at the weekends, Edinburgh, Barnbougle Castle,
8754,https://www.movie-locations.com/movies/p/Prime-Of-Miss-Jean-Brodie-Grims-Dyke-Hotel.jpg, the interior of the library at 'Marcia Blaine', Harrow Weald, Old Redding, Grim's Dyke Hotel
71989,https://www.movie-locations.com/movies/p/Prima-Della-Rivoluzione-Parma.jpg, Fabrizio and Gina hang about in the town square, Italy, Parma, Piazza Garibaldi
40629,https://www.movie-locations.com/movies/p/Pride-And-Prejudice-2005-Groombridge-Place.jpg, ‘Longbourn’, Kent, Groombridge Place,
40629,https://www.movie-locations.com/movies/p/../d/Da-Vinci-Code-Burghley-House.jpg, ‘Rosings’, Lincolnshire, Burghley House,
40629,https://www.movie-locations.com/movies/p/Pride-And-Prejudice-2005-Weekley.jpg, Mr Collins’ vicarage, Northamptonshire, Weekley,
40629,https://www.movie-locations.com/movies/p/Pride-And-Prejudice-2005-Basildon-Park-House.jpg, ‘Netherfield Park’, Berkshire, Lower Basildon, Basildon Park House
40629,https://www.movie-locations.com/movies/p/Pride-And-Prejudice-2005-Stourhead-Gardens.jpg, Darcy makes his first unsuccessful proposal to Elizabeth , Wiltshire, Stourton, Stourhead Gardens
40629,https://www.movie-locations.com/movies/p/Pride-And-Prejudice-Chatsworth-House.jpg, Mr Darcy’s ‘Pemberley’, Derbyshire, Chatsworth House,
40629,https://www.movie-locations.com/movies/p/../m/Music-Lovers-Wilton-House.jpg, interiors for Mr Darcy’s ‘Pemberley’, Wiltshire, Wilton, Wilton House
40629,https://www.movie-locations.com/movies/p/Pride-And-Prejudice-2005-Stanage-Edge.jpg, ‘Elizabeth stands atop the dramatic rocky outcrop, Derbyshire, Peak District, Stanage Edge
3547,https://www.movie-locations.com/movies/p/Prick-Up-Your-Ears-St-Peters.jpg, the Noel Road flat, London N1, Islington, St Peter’s Street
3547,https://www.movie-locations.com/movies/p/Prick-Up-Your-Ears-cottage.jpg, the orgy in the cottage,-,-, Tower Bridge Road
597,https://www.movie-locations.com/movies/p/Pretty-Woman-Las-Palmas-Hotel.jpg, Julia Roberts' scuzzy hotel, Los Angeles, Hollywood," 1738 Las Palmas Avenue,  Las Palmas Hotel"
597,https://www.movie-locations.com/movies/p/Pretty-Woman-Beverly-Wilshire.jpg, Julia Roberts gets a taste of the high-life, Los Angeles, Beverly Hills," 9500 Wilshire Boulevard,  Regent Beverly Wilshire"
597,https://www.movie-locations.com/movies/p/Pretty-Woman-Rodeo-Drive-store.jpg, “big mistake... huge”, Los Angeles, Julia Roberts is snubbed by the boutique staff:  9501 Santa Monica Boulevard. Beverly Hills,
597,https://www.movie-locations.com/movies/p/Cicada-Restaurant.jpg,  “Slippery little suckers...”, downtown Los Angeles, 617 South Olive Street, Julia Roberts struggles with snails at Cicada
597,https://www.movie-locations.com/movies/p/Pretty-Woman-Natural-History-Museum-Of-LA.jpg, the ‘San Francisco’ opera house, Los Angeles, Exposition Park, Natural History Museum of Los Angeles County
2145,https://www.movie-locations.com/movies/p/Pretty-In-Pink-Hope-St-Pasadena.jpg, Andie’s house on the wrong side of the tracks, Los Angeles, Pasadena, Hope Street
2145,https://www.movie-locations.com/movies/p/Pretty-In-Pink-John-Marshall-High-School-2.jpg, ‘Meadowbrook High School’, Silverlake, Tracy Street, John Marshall High School
2145,https://www.movie-locations.com/movies/p/Pretty-In-Pink-June-Street.jpg, Steff’s party mansion, Los Angeles, Hancock Park, June Street
2145,https://www.movie-locations.com/movies/p/../g/Ghostbuster-Millennium-Biltmore-Hotel-Galleria.jpg, the prom, downtown Los Angeles, South Grand Avenue, Millennium Biltmore Hotel
3527,https://www.movie-locations.com/movies/p/Predator-Misol-Ha.jpg, the waterfall from which Arnie leaps, Mexico, Palenque, Misol Ha
58,https://www.movie-locations.com/movies/p/Postino_Procida.jpg, the port, Italy, Bay of Naples," Procida,  Marina di Corricella"
58,https://www.movie-locations.com/movies/p/Postino_Procida_bar.jpg, the bar, Italy, Bay of Naples," Procida,  Marina Corricella,  via Marina Corricella,  Bar La Taverna del Postino"
1994,https://www.movie-locations.com/movies/p/Poltergeist-Roxbury-Street.jpg, the Freeling house, Los Angeles, Simi Valley," Forest Hills,  Roxbury Street"
2378,https://www.movie-locations.com/movies/p/Police-Academy-Humber-Lakeshore-Campus.jpg, the Academy HQ, Toronto, Humber Lakeshore Campus,
2378,https://www.movie-locations.com/movies/p/Police-Academy-Riverdale-Mall.jpg, Leslie Barbara's 'Fotofast' booth, Toronto, Riverdale, Carlaw Avenue
2378,https://www.movie-locations.com/movies/p/Police-Academy-Cherry-Street-Bridge.jpg, Leslie Barbara and his booth are dumped into the river, Toronto, Port Lands, Cherry Street Trunnion Bridge
2378,https://www.movie-locations.com/movies/p/Police-Academy-Colborne-at-Victoria-Streets.jpg, Lt Harris has a close encounter with a horse's rear end, Toronto, Colborne Street at Victoria Street,
2378,https://www.movie-locations.com/movies/p/Police-Academy-Dundas-High-Park.jpg, Fackler unwittingly triggers off the bar fight, Toronto, Dundas Street at High Park Avenue,
2378,https://www.movie-locations.com/movies/p/Police-Academy-Dupont-Street-riot.jpg," ""Hey, free TVs!"" at the second-hand store", Toronto, Dupont Street at Edwin Avenue,
2378,https://www.movie-locations.com/movies/p/Police-Academy-Baldwin-Street.jpg, Mahoney and Jones on the deserted street, Toronto, Kensington Market, Baldwin Street at Augusta Avenue
2378,https://www.movie-locations.com/movies/p/Police-Academy-Toy-Factory-Lofts.jpg, Hightower rescues Harris and Mahoney on the warehouse roof, Toronto, Liberty Village," Halma Avenue,  Toy Factory Lofts"
4351,https://www.movie-locations.com/movies/p/Point-Break-Main-Street-Culver-City.jpg, Pappas and Utah stake out the ‘Assured Trust Savings Loan Bank', Los Angeles, Culver City, Main Street
4351,https://www.movie-locations.com/movies/p/../f/Fast-And-The-Furious-Neptunes-Net.jpg, Johnny Utah gives Tyler his sob-story, Malibu, Pacific Coast Highway, Neptune’s Net
26172,https://www.movie-locations.com/movies/p/../e/Escape-From-Alcatraz-Alcatraz-Island.jpg, the opening money drop, San Francisco Bay, Alcatraz Island,
26172,https://www.movie-locations.com/movies/p/Point-Blank-Miller-Drive.jpg, Walker barges into his wife's new home, West Hollywood, Miller Drive,
26172,https://www.movie-locations.com/movies/p/Point-Blank-Huntley-Hotel-entrance-2.jpg, the entrance to the penthouse of double-crossing Mal Reese, Santa Monica, 2nd Street, Huntley Hotel
26172,https://www.movie-locations.com/movies/p/Point-Blank-Huntley-Hotel-tower.jpg, the well-guarded penthouse of double-crossing Mal Reese, Santa Monica, 2nd Street, Huntley Hotel
26172,https://www.movie-locations.com/movies/p/Point-Blank-Fort-Point.jpg, the final money drop, San Francisco Bay, Fort Point,
4643,https://www.movie-locations.com/movies/p/Planet-Of-The-Apes-2001-Trona-Pinnacles.jpg, ‘Calima’ – birthplace of ape civilisation, California, near Ridgecrest, Trona Pinnacles
4002,https://www.movie-locations.com/movies/p/Planes-Trains-And-Automobiles-Braidwood.jpg, “They’re not pillows!”, Illinois, Braidwood," South Hickory Street,  Sun Motel"
1924,https://www.movie-locations.com/movies/p/Plan-9-From-Outer-Space-Quality-Studios.jpg, Can your heart stand the shocking facts?, Hollywood, Santa Monica Boulevard, site of Quality Studios
1924,https://www.movie-locations.com/movies/p/Plan-9-From-Outer-Space-Lakeside-Street.jpg, the home of the heartbroken old man, California, Sylmar, Lakeside Street
86880,https://www.movie-locations.com/movies/p/Pirates-Of-The-Caribbean-On-Stranger-Tides-Hampton-Court-Palace.jpg, Jack and Gibbs are taken off to St James Palace, Surrey, East Molesey, Hampton Court Palace
86880,https://www.movie-locations.com/movies/p/Pirates-Of-The-Caribbean-At Worlds-End-Bonneville-Salt-Flats.jpg, a shipful of Jack Sparrows stranded in ‘Davy Jones’s Locker’, Utah, Bonneville Salt Flats,
45722,https://www.movie-locations.com/movies/p/Pirates-Of-The-Caribbean-Dead-Mans-Chest-Hampstead-Beach.jpg, Jack Sparrow escapes the cannibal,-,-, Jack Sparrow escapes the cannibals
2361,https://www.movie-locations.com/movies/p/Pink-Flamingos-Tyson-Street.jpg," ""Not only is she the Filthiest Person in the World, she is also the Filthiest Actress in the World”", Maryland, Baltimore, Tyson Street
2361,https://www.movie-locations.com/movies/p/Pink_Flamingos_Greenmount_Avenue.jpg, the home of Connie and Raymond Marble, Maryland, Baltimore, Greenmount Avenue
1913,https://www.movie-locations.com/movies/p/Picnic-At-Hanging-Rock-Hanging-Rock.jpg, the girls disappear on a day out, Victoria, Woodend, Hanging Rock
1913,https://www.movie-locations.com/movies/p/Picnic-At-Hanging-Rock-Martindale-Hall.jpg, ‘Appleyard Girls’ School’, South Australia, Martindale," Manoora Road,  Martindale Hall"
6281,https://www.movie-locations.com/movies/p/Phone-Booth-West-5th-Street.jpg, trapped in the ‘New York’ phone booth, downtown Los Angeles, Fifth Street,
4789,https://www.movie-locations.com/movies/p/Phantom-Of-The-Paradise-Majestic-Theatre.jpg, the Paradise rock palace, Texas, Dallas, Majestic Theatre
4789,https://www.movie-locations.com/movies/p/Phantom-Of-The-Paradise-Dallas-County-Courthouse.jpg, the exterior of the ‘Swanage’ mansion, Texas, Dallas," Dallas County Courthouse,  Old Red Museum"
4789,https://www.movie-locations.com/movies/p/Phantom-Of-The-Paradise-Greystone.jpg, the interior of the ‘Swanage’ mansion, Los Angeles, Beverly Hills, Greystone Mansion
2901,https://www.movie-locations.com/movies/p/../v/View-To-A-Kill-Dunsmuir-House.jpg, the mausoleum,-,-, Dunsmuir House and Gardens
26231,https://www.movie-locations.com/movies/p/Performance-Powis-Square.jpg, The Notting Hill retreat of Turner Purple, London W11, Powis Square,
26231,https://www.movie-locations.com/movies/p/Performance-Wandsworth-Town.jpg, Chas phones Harry Flowers for help, London SW18, Wandsworth, Old York Road
26231,https://www.movie-locations.com/movies/p/Performance-Mount-Street.jpg, Gang boss Harry Flowers’ office, London W1, Mayfair, 115 Mount Street
3608,https://www.movie-locations.com/movies/p/Pee-Wees-Big-Adventure-Oxley-Street.jpg, Pee-wee’s house, South Pasadena, Oxley Street,
4310,https://www.movie-locations.com/movies/p/Pearl-Harbor-Luna-Park.jpg, ‘Haleiwi Motor Court’, Los Angeles, Lincoln Heights, Luna Park Auto Court
4310,https://www.movie-locations.com/movies/p/Pearl-Harbor-Warner-Grand.jpg, Watching The Great Dictator at the 'Honolulu' cinema, Los Angeles, San Pedro," 478 West Sixth Street,  Warner Grand Theater"
4310,https://www.movie-locations.com/movies/p/Pearl-Harbor-West-Sixth-Street.jpg," The 'Black Cat Diner, Honolulu'", Los Angeles, San Pedro, 474 West Sixth Street
1178,https://www.movie-locations.com/movies/p/../a/Annee-Derniere-A-Marienbad-Schleissheim.jpg, the grand exterior,-,-, Schloss Schleissheim
42546,https://www.movie-locations.com/movies/p/Passport_To_Pimlico_Kennington.jpg, ‘Pimlico’ declares independence from the UK, London, Lambeth Road, railway bridge
4287,https://www.movie-locations.com/movies/p/../b/Belle_De_Jour_Grand_Cascade.jpg, Holden and Hepburn dine on the terrace of the Chalet de la Grande Cascade, Paris, Bois de Boulogne,
2201,https://www.movie-locations.com/movies/p/Paradine-Case-Wilton-Crescent.jpg, Mrs Paradine’s palatial Belgravia home, SW1 London, 33 Wilton Crescent,
48394,https://www.movie-locations.com/movies/p/Pans-Labyrinth-Guadarrama.jpg, the farmhouse where Ofelia encounters the Faun, Spain, Guadarrama Mountains, San Rafael
48394,https://www.movie-locations.com/movies/p/../a/Adventures-Of-Baron-Munchausen-Belchite.jpg, the ruined town, Spain, Belchite,
3199,https://www.movie-locations.com/movies/p/Pal-Joey-Coit-Tower-entrance.jpg, the entrance, San Francisco, Telegraph Hill, Coit Tower
117887,https://www.movie-locations.com/movies/p/Paddington-clock.jpg, the little bear arrives in London and gets a new name, London, Paddington," Praed Street,  Paddington Station"
